symbol,valid_url,title,publish_time
CTI,https://vietstock.vn/2026/01/phan-tich-ky-thuat-phien-chieu-2201-kho-thoat-the-giang-co-585-1393913.htm,Phân tích kỹ thuật phiên chiều 22/01: Khó thoát thế giằng co,2026-01-22T13:06:39.043
XPH,https://vietstock.vn/2025/08/xph-thong-bao-nguoi-khong-con-la-nguoi-noi-bo-nguoi-co-lien-quan-739-1343359.htm,"XPH: Thông báo người không còn là người nội bộ, người có liên quan",2025-08-19T15:09:00
LG9,https://vietstock.vn/2025/07/lg9-bao-cao-quan-tri-cong-ty-ban-nien-2025-737-1334042.htm,LG9: Báo cáo quản trị công ty bán niên 2025,2025-07-29T12:10:00
CMC,https://vietstock.vn/2026/02/cmc-group-lam-moi-ke-hoach-lap-cong-ty-dau-tu-cong-nghe-sau-gan-3-nam-737-1402718.htm,CMC Group “làm mới” kế hoạch lập công ty đầu tư công nghệ sau gần 3 năm,2026-02-11T10:55:55.71
STW,https://vietstock.vn/2025/12/stw-bao-cao-thay-doi-so-huu-co-phieu-cua-co-dong-lon-nghiem-thi-le-hang-739-1379237.htm,STW: Báo cáo thay đổi sở hữu cổ phiếu của cổ đông lớn - Nghiêm Thị Lệ Hằng,2025-12-08T12:25:00
VNA,https://vietstock.vn/2026/02/vna-bao-cao-tai-chinh-nam-2025-737-1403958.htm,VNA: Báo cáo tài chính năm 2025,2026-02-13T15:32:00
PJS,https://vietstock.vn/2025/09/pjs-ngay-dang-ky-cuoi-cung-tra-co-tuc-bang-tien-mat-737-1349433.htm,PJS: Ngày đăng ký cuối cùng trả cổ tức bằng tiền mặt,2025-09-05T10:02:00
KHG,https://vietstock.vn/2026/03/khg-ket-qua-dieu-chinh-hoi-to-bctc-hn-va-rieng-nam-2024-da-kiem-toan-737-1419537.htm,KHG: Kết quả điều chỉnh hồi tố BCTC HN và riêng năm 2024 đã kiểm toán,2026-03-31T13:50:49
NSL,https://vietstock.vn/2026/01/nsl-bao-cao-quan-tri-cong-ty-nam-2025-737-1395461.htm,NSL: Báo cáo quản trị công ty năm 2025,2026-01-27T10:07:00
PVD,https://vietstock.vn/2026/03/pvd-nghi-quyet-hdqt-so-04-3-2026-va-05-3-2026-ngay-25-03-2026-737-1416441.htm,PVD: Nghị quyết HĐQT số 04/3/2026 và 05/3/2026 ngày 25/03/2026,2026-03-25T17:40:56
PEG,https://vietstock.vn/2026/02/peg-quyet-dinh-ve-viec-duy-tri-dien-canh-bao-va-thong-bao-ve-trang-thai-chung-khoan-830-1402101.htm,PEG: Quyết định về việc duy trì diện cảnh báo và Thông báo về trạng thái chứng khoán,2026-02-09T17:29:00
BSP,https://vietstock.vn/2026/01/bsp-bao-cao-tai-chinh-quy-4-2025-737-1392580.htm,BSP: Báo cáo tài chính quý 4/2025,2026-01-20T09:51:00
DDN,https://vietstock.vn/2026/02/ddn-ngay-dang-ky-cuoi-cung-dai-hoi-dong-co-dong-thuong-nien-nam-2026-737-1403501.htm,DDN: Ngày đăng ký cuối cùng Đại hội đồng cổ đông thường niên năm 2026,2026-02-12T16:15:00
AVG,https://vietstock.vn/2026/02/avg-nghi-quyet-hoi-dong-quan-tri-737-1401308.htm,AVG: Nghị quyết Hội đồng quản trị,2026-02-06T14:09:00
VLW,https://vietstock.vn/2025/10/nuoc-vinh-long-thu-hep-loi-nhuan-biwase-tiep-tuc-nang-so-huu-737-1365595.htm,"Nước Vĩnh Long thu hẹp lợi nhuận, Biwase tiếp tục nâng sở hữu",2025-10-27T11:24:43.75
HAG,https://vietstock.vn/2026/03/hoang-anh-gia-lai-quyet-dut-no-trai-phieu-gan-11-ngan-ty-ngay-trong-thang-3-3118-1414752.htm,Hoàng Anh Gia Lai quyết dứt nợ trái phiếu gần 1.1 ngàn tỷ ngay trong tháng 3,2026-03-21T12:26:26.497
HTT,https://vietstock.vn/2026/02/htt-ngay-dang-ky-cuoi-cung-dai-hoi-dong-co-dong-thuong-nien-nam-2026-737-1403923.htm,HTT: Ngày đăng ký cuối cùng Đại hội đồng cổ đông thường niên năm 2026,2026-02-13T14:56:00
CMN,https://vietstock.vn/2026/01/cmn-thong-bao-ve-ngay-dang-ky-cuoi-cung-de-thuc-hien-quyen-tham-du-dai-hoi-dong-co-dong-bat-thuong-nam-2026-737-1394542.htm,CMN: Thông báo về ngày đăng ký cuối cùng để thực hiện quyền tham dự Đại Hội Đồng Cổ Đông bất thường năm 2026,2026-01-23T16:10:00
FGL,https://vietstock.vn/2026/02/fgl-nghi-quyet-hoi-dong-quan-tri-737-1399507.htm,FGL: Nghị quyết Hội đồng quản trị,2026-02-03T10:59:00
SLS,https://vietstock.vn/2025/09/sls-ngay-dang-ky-cuoi-cung-tra-co-tuc-bang-tien-mat-737-1356967.htm,SLS: Ngày đăng ký cuối cùng trả cổ tức bằng tiền mặt,2025-09-30T15:01:00
BEL,https://vietstock.vn/2026/03/belco-thay-chu-tich-tong-giam-doc-co-phieu-roi-manh-214-1407036.htm,"Belco thay Chủ tịch, Tổng Giám đốc, cổ phiếu rơi mạnh",2026-03-02T16:30:00
CHS,https://vietstock.vn/2025/12/chs-thong-bao-chi-tra-co-tuc-nam-2024-bang-tien-mat-738-1378678.htm,CHS: Thông báo chi trả cổ tức năm 2024 bằng tiền mặt,2025-12-05T10:41:00
DGT,https://vietstock.vn/2026/02/dgt-bao-cao-tai-chinh-quy-4-2025-737-1401468.htm,DGT: Báo cáo tài chính quý 4/2025,2026-02-06T16:19:00
APG,https://vietstock.vn/2026/04/apg-thong-bao-nhan-duoc-don-tu-nhiem-thanh-vien-hdqt-214-1421080.htm,APG: Thông báo nhận được Đơn từ nhiệm thành viên HĐQT,2026-04-01T17:14:47
D11,https://vietstock.vn/2025/11/d11-dieu-le-cong-ty-cap-nhat-thang-11-2025-737-1375402.htm,D11: Điều lệ công ty - cập nhật tháng 11/2025,2025-11-25T16:48:00
SSC,https://vietstock.vn/2026/02/ssc-nghi-quyet-hdqt-ve-ngay-dang-ky-cuoi-cung-to-chuc-dhdcd-thuong-nien-nam-2026-737-1406450.htm,SSC: Nghị quyết HĐQT về ngày đăng ký cuối cùng tổ chức ĐHĐCĐ thường niên năm 2026,2026-02-27T16:29:51
ASM,https://vietstock.vn/2026/03/asm-nghi-quyet-hdqt-ve-viec-to-chuc-dhdcdtn-2026-737-1406824.htm,ASM: Nghị quyết HĐQT về việc tổ chức ĐHĐCĐTN 2026,2026-03-02T09:29:57
HPX,https://vietstock.vn/2026/02/hpx-nghi-quyet-hdqt-ve-viec-thong-qua-chu-truong-thuc-hien-cac-hop-dong-giao-dich-voi-ben-co-lien-quan-737-1403513.htm,"HPX: Nghị quyết HĐQT về việc thông qua chủ trương thực hiện các hợp đồng, giao dịch với bên có liên quan",2026-02-12T16:35:09
TVH,https://vietstock.vn/2025/11/tvh-thong-bao-ty-le-so-huu-nuoc-ngoai-toi-da-50-739-1373581.htm,TVH: Thông báo tỷ lệ sở hữu nước ngoài tối đa (50%),2025-11-19T14:36:00
VTV,https://vietstock.vn/2026/01/vtv-nghi-quyet-hoi-dong-quan-tri-737-1397253.htm,VTV: Nghị quyết Hội đồng quản trị,2026-01-30T10:30:00
ISH,https://vietstock.vn/2025/10/ish-bao-cao-tai-chinh-quy-3-2025-737-1363363.htm,ISH: Báo cáo tài chính quý 3/2025,2025-10-20T19:46:00
TIN,https://vietstock.vn/2026/03/tin-ngay-dang-ky-cuoi-cung-thuc-hien-quyen-ung-cu-de-cu-nhan-su-du-kien-bau-bo-sung-thanh-vien-hoi-dong-quan-tri-nhiem-ky-20232028-737-1411256.htm,"TIN: Ngày đăng ký cuối cùng Thực hiện Quyền ứng cử, đề cử nhân sự dự kiến bầu bổ sung thành viên Hội đồng quản trị nhiệm kỳ 2023-2028",2026-03-12T08:55:00
VCC,https://vietstock.vn/2026/01/vcc-bao-cao-tai-chinh-quy-4-2025-737-1393441.htm,VCC: Báo cáo tài chính quý 4/2025,2026-01-21T14:37:00
SCI,https://vietstock.vn/2026/03/sci-tai-lieu-hop-dai-hoi-dong-co-dong-737-1413057.htm,SCI: Tài liệu họp Đại hội đồng cổ đông,2026-03-17T14:28:00
UXC,https://vietstock.vn/2026/02/uxc-nghi-quyet-hoi-dong-quan-tri-737-1402472.htm,UXC: Nghị quyết Hội đồng quản trị,2026-02-10T15:59:00
HAH,https://vietstock.vn/2026/04/hah-thong-bao-giao-dich-co-phieu-cua-nguoi-co-lien-quan-cua-nguoi-noi-bo-nguyen-thanh-long-tran-dinh-trung-nguyen-linh-chi-739-1424248.htm,"HAH: Thông báo giao dịch cổ phiếu của người có liên quan của Người nội bộ Nguyễn Thanh Long, Trần Đình Trung, Nguyễn Linh Chi",2026-04-07T16:35:47
MTV,https://vietstock.vn/2026/03/lgc-thong-bao-giao-dich-co-phieu-cua-to-chuc-co-lien-quan-den-nguoi-noi-bo-cong-ty-tnhh-mtv-dich-vu-va-dau-tu-cii-737-1417650.htm,LGC: Thông báo giao dịch cổ phiếu của tổ chức có liên quan đến người nội bộ Công ty TNHH MTV Dịch vụ và Đầu tư CII,2026-03-27T16:00:39
L35,https://vietstock.vn/2026/01/l35-bao-cao-quan-tri-cong-ty-nam-2025-737-1394521.htm,L35: Báo cáo quản trị công ty năm 2025,2026-01-23T15:32:00
VNR,https://vietstock.vn/2026/03/vnr-cong-bo-thong-tin-ve-viec-lap-danh-sach-co-dong-co-quyen-tham-du-hop-dai-hoi-dong-co-dong-thuong-nien-nam-2026-737-1407619.htm,VNR: Công bố thông tin về việc lập danh sách cổ đông có quyền tham dự họp đại hội đồng cổ đông thường niên năm 2026,2026-03-03T09:44:00
VGT,https://vietstock.vn/2026/02/vgt-bao-cao-quan-tri-cong-ty-nam-2025-737-1400933.htm,VGT: Báo cáo quản trị công ty năm 2025,2026-02-05T14:31:00
PCM,https://vietstock.vn/2026/02/pcm-thong-bao-ve-ngay-dang-ky-cuoi-cung-thuc-hien-quyen-tham-du-dai-hoi-dong-co-dong-thuong-nien-2026-737-1403850.htm,PCM: Thông báo về ngày đăng ký cuối cùng thực hiện quyền tham dự Đại hội đồng cổ đông thường niên 2026,2026-02-13T14:01:00
PVM,https://vietstock.vn/2026/02/pvm-bao-cao-tai-chinh-quy-4-2025-cong-ty-me-737-1399300.htm,PVM: Báo cáo tài chính quý 4/2025 (công ty mẹ),2026-02-02T18:17:00
SGT,https://vietstock.vn/2026/02/sgt-bao-cao-ve-ngay-khong-con-la-co-dong-lon-cong-ty-co-phan-thiet-ke-va-xay-dung-thanh-pho-moi-739-1400616.htm,SGT: Báo cáo về ngày không còn là cổ đông lớn Công ty Cổ phần Thiết kế và Xây dựng Thành Phố Mới,2026-02-04T17:43:21
BMJ,https://vietstock.vn/2026/03/bmj-bao-cao-tai-chinh-nam-2025-cong-ty-me-737-1413387.htm,BMJ: Báo cáo tài chính năm 2025 (Công ty mẹ),2026-03-18T09:13:00
COM,https://vietstock.vn/2026/02/com-nghi-quyet-hdqt-ve-chi-tam-ung-co-tuc-nam-2025-737-1402622.htm,COM: Nghị quyết HĐQT về chi tạm ứng cổ tức năm 2025,2026-02-10T17:46:59
API,https://vietstock.vn/2026/02/api-bao-cao-quan-tri-nam-2025-737-1400799.htm,API: Báo cáo quản trị năm 2025,2026-02-05T10:59:00
FHN,https://vietstock.vn/2025/11/fhn-bo-nhiem-ong-duong-tuan-linh-giu-chuc-pho-giam-doc-ba-bui-thi-thu-thuy-dam-nhan-vi-tri-truong-phong-tai-chinh-ke-toan-214-1376098.htm,FHN: Bổ nhiệm Ông Dương Tuấn Linh giữ chức Phó Giám đốc - Bà Bùi Thị Thu Thủy đảm nhận vị trí Trưởng phòng Tài chính kế toán,2025-11-27T15:53:00
DTK,https://vietstock.vn/2026/02/dtk-bao-cao-tai-chinh-quy-4-2025-cong-ty-me-737-1399875.htm,DTK: Báo cáo tài chính quý 4/2025 (công ty mẹ),2026-02-03T17:09:00
LHG,https://vietstock.vn/2026/02/no-vay-doanh-nghiep-bat-dong-san-tren-san-len-gan-400-ngan-ty-dong-trong-nam-2025-737-1403939.htm,Nợ vay doanh nghiệp bất động sản trên sàn lên gần 400 ngàn tỷ đồng trong năm 2025,2026-02-24T10:02:00
TYA,https://vietstock.vn/2026/03/tya-thong-bao-ve-ngay-dang-ky-cuoi-cung-to-chuc-hop-dhdcd-thuong-nien-nam-2026-737-1411296.htm,TYA: Thông báo về ngày đăng ký cuối cùng tổ chức họp ĐHĐCĐ thường niên năm 2026,2026-03-12T09:34:45
VEA,https://vietstock.vn/2026/01/vea-bao-cao-tai-chinh-quy-4-2025-cong-ty-me-737-1397097.htm,VEA: Báo cáo tài chính quý 4/2025 (công ty mẹ),2026-01-30T08:34:00
KLB,https://vietstock.vn/2026/03/klb-bctc-nam-2025-737-1419247.htm,KLB: BCTC năm 2025 ,2026-03-30T00:00:00
HAC,https://vietstock.vn/2026/03/hac-cong-bo-thong-tin-nghi-quyet-hdqt-thong-qua-phuong-an-dau-tu-trai-phieu-board-of-directors-resolution-approves-bond-investment-plan-737-1415531.htm,HAC: Công bố thông tin Nghị quyết HĐQT thông qua phương án đầu tư Trái phiếu/ Board of Directors Resolution Approves Bond Investment Plan,2026-03-24T00:00:00
TCI,https://vietstock.vn/2026/03/tci-thong-bao-ve-viec-gia-han-thoi-gian-to-chuc-dhdcd-thuong-nien-nam-2026-737-1417420.htm,TCI: Thông báo về việc gia hạn thời gian tổ chức ĐHĐCĐ thường niên năm 2026,2026-03-27T00:00:00
MRF,https://vietstock.vn/2026/02/mrf-ong-luu-tien-cao-duoc-bau-giu-chuc-chu-tich-hoi-dong-quan-tri-thay-cho-ong-vu-van-minh-214-1399066.htm,MRF: Ông Lưu Tiến Cảo được bầu giữ chức Chủ tịch Hội đồng quản trị thay cho Ông Vũ Văn Minh,2026-02-02T16:01:00
PMP,https://vietstock.vn/2025/09/pmp-ngay-dang-ky-cuoi-cung-tra-co-tuc-bang-tien-mat-737-1350820.htm,PMP: Ngày đăng ký cuối cùng trả cổ tức bằng tiền mặt,2025-09-09T17:02:00
DQC,https://vietstock.vn/2026/03/dqc-thong-bao-thu-moi-va-duong-dan-tai-lieu-hop-dhdcd-thuong-nien-nam-2026-737-1415985.htm,DQC: Thông báo thư mời và đường dẫn tài liệu họp ĐHĐCĐ thường niên năm 2026,2026-03-25T09:02:17
TMC,https://vietstock.vn/2025/12/tmc-bo-nhiem-ba-nguyen-phuong-thao-giu-chuc-vu-nguoi-phu-trach-quan-tri-cong-ty-thay-cho-ba-nghiem-thi-thanh-mai-214-1378838.htm,TMC: Bổ nhiệm Bà Nguyễn Phương Thảo giữ chức vụ người phụ trách quản trị Công ty thay cho Bà Nghiêm Thị Thanh Mai,2025-12-05T16:23:00
PCG,https://vietstock.vn/2026/02/pcg-bao-cao-tai-chinh-quy-4-2025-737-1399135.htm,PCG: Báo cáo tài chính quý 4/2025,2026-02-02T16:48:00
S12,https://vietstock.vn/2025/09/s12-cong-bo-thong-tin-ve-ket-qua-dot-chao-ban-co-phieu-cong-ty-co-phan-song-da-cao-cuong-ra-cong-chung-739-1355836.htm,S12: Công bố thông tin về kết quả đợt chào bán cổ phiếu Công ty cổ phần Sông Đà Cao Cường ra công chúng,2025-09-26T09:52:00
SGP,https://vietstock.vn/2026/03/sgp-nghi-quyet-hoi-dong-quan-tri-737-1407250.htm,SGP: Nghị quyết Hội đồng quản trị,2026-03-02T17:44:00
PTO,https://vietstock.vn/2025/12/pto-ngay-dang-ky-cuoi-cung-tra-co-tuc-bang-tien-mat-737-1382088.htm,PTO: Ngày đăng ký cuối cùng trả cổ tức bằng tiền mặt,2025-12-17T15:47:00
ITA,https://vietstock.vn/2025/11/no-vay-doanh-nghiep-bat-dong-san-tren-san-tang-37-so-voi-dau-nam-737-1373458.htm,Nợ vay doanh nghiệp bất động sản trên sàn tăng 37% so với đầu năm,2025-11-24T11:02:00
TJC,https://vietstock.vn/2026/03/tjc-nghi-quyet-hoi-dong-quan-tri-737-1408637.htm,TJC: Nghị quyết Hội đồng quản trị,2026-03-05T15:05:00
MKV,https://vietstock.vn/2026/03/mkv-nghi-quyet-hoi-dong-quan-tri-737-1412668.htm,MKV: Nghị quyết Hội đồng quản trị,2026-03-16T15:58:00
TCJ,https://vietstock.vn/2025/07/tcj-thay-doi-giay-dang-ky-kinh-doanh-737-1336525.htm,TCJ: Thay đổi giấy đăng ký kinh doanh,2025-07-31T21:16:00
HLT,https://vietstock.vn/2025/11/hlt-don-xin-tu-nhiem-830-1376436.htm,HLT: Đơn xin từ nhiệm,2025-11-28T09:30:00
PLA,https://vietstock.vn/2026/01/pla-bao-cao-quan-tri-cong-ty-nam-2025-737-1397223.htm,PLA: Báo cáo quản trị công ty năm 2025,2026-01-30T10:07:00
GVR,https://vietstock.vn/2026/01/gvr-bctc-hop-nhat-quy-4-nam-2025-737-1396941.htm,GVR: BCTC Hợp nhất quý 4 năm 2025 ,2026-01-29T00:00:00
DAD,https://vietstock.vn/2025/12/dad-nghi-quyet-hoi-dong-quan-tri-737-1385890.htm,DAD: Nghị quyết Hội đồng quản trị,2025-12-29T15:59:00
VCG,https://vietstock.vn/2026/03/vcg-quyet-dinh-cua-hdqt-ve-viec-giam-ty-le-so-huu-von-tai-viwaseen-739-1413031.htm,VCG: Quyết định của HĐQT về việc giảm tỷ lệ sở hữu vốn tại VIWASEEN,2026-03-17T14:12:15
WCS,https://vietstock.vn/2026/01/wcs-bao-cao-tai-chinh-quy-4-2025-737-1393263.htm,WCS: Báo cáo tài chính quý 4/2025,2026-01-21T10:13:00
LAF,https://vietstock.vn/2026/01/laf-bctc-quy-4-nam-2025-737-1392420.htm,LAF: BCTC quý 4 năm 2025 ,2026-01-19T00:00:00
VPL,https://vietstock.vn/2026/02/vpl-bao-cao-tinh-hinh-quan-tri-cong-ty-nam-2025-737-1398878.htm,VPL: Báo cáo tình hình quản trị công ty năm 2025,2026-02-02T14:01:10
BIG,https://vietstock.vn/2026/03/big-thay-doi-nhan-su-214-1417537.htm,BIG: Thay đổi nhân sự,2026-03-27T14:43:00
ACG,https://vietstock.vn/2026/02/acg-nghi-quyet-hdqt-ve-viec-thong-qua-viec-thuc-hien-cac-hop-dong-giao-dich-voi-nguoi-co-lien-quan-bo-sung-737-1401946.htm,"ACG: Nghị quyết HĐQT về việc thông qua việc thực hiện các hợp đồng, giao dịch với người có liên quan (bổ sung)",2026-02-09T16:00:53
SBS,https://vietstock.vn/2026/03/isc-sbs-cbtt-giay-chung-nhan-mau-dau-chi-nhanh-sai-gon-sbs-disclosure-sample-certificate-of-saigon-branch-737-1416163.htm,ISC: SBS CBTT Giấy chứng nhận mẫu dấu chi nhánh Sài Gòn / SBS Disclosure Sample Certificate of Saigon Branch,2026-03-25T00:00:00
DDV,https://vietstock.vn/2026/01/ddv-lap-ky-luc-loi-nhuan-tien-gui-ngan-hang-gap-doi-no-737-1396053.htm,"DDV lập kỷ lục lợi nhuận, tiền gửi ngân hàng gấp đôi nợ",2026-01-28T14:02:00
IHK,https://vietstock.vn/2025/08/ihk-thay-doi-giay-dang-ky-kinh-doanh-737-1338636.htm,IHK: Thay đổi giấy đăng ký kinh doanh,2025-08-06T13:52:00
VPX,https://vietstock.vn/2026/03/vpx-bao-cao-tai-chinh-rieng-le-nam-2025-737-1412825.htm,VPX: Báo cáo tài chính riêng lẻ  năm 2025,2026-03-16T19:14:00
THN,https://vietstock.vn/2025/07/thn-ngay-dang-ky-cuoi-cung-tra-co-tuc-bang-tien-mat-737-1336555.htm,THN: Ngày đăng ký cuối cùng trả cổ tức bằng tiền mặt,2025-07-31T23:44:00
HFX,https://vietstock.vn/2025/07/hfx-don-xin-tu-chuc-ct-hdqt-830-1327328.htm,HFX: Đơn xin từ chức CT HĐQT,2025-07-11T15:36:00
NSC,https://vietstock.vn/2026/02/nsc-nghi-quyet-hdqt-ve-ke-hoach-to-chuc-dhdcd-thuong-nien-nam-2026-737-1406224.htm,NSC: Nghị quyết HĐQT về kế hoạch tổ chức ĐHĐCĐ thường niên năm 2026,2026-02-27T13:37:10
ACV,https://vietstock.vn/2026/03/acv-bo-nhiem-quyen-chu-tich-sau-khi-ong-vu-the-phiet-bi-tam-giam-214-1413725.htm,ACV bổ nhiệm quyền Chủ tịch sau khi ông Vũ Thế Phiệt bị tạm giam,2026-03-18T18:23:04.127
S74,https://vietstock.vn/2025/12/s74-nghi-quyet-hoi-dong-quan-tri-737-1381710.htm,S74: Nghị quyết Hội đồng quản trị,2025-12-16T16:29:00
PRE,https://vietstock.vn/2026/02/pre-bao-cao-quan-tri-cong-ty-nam-2025-737-1399048.htm,PRE: Báo cáo quản trị công ty năm 2025,2026-02-02T15:44:00
VTB,https://vietstock.vn/2026/01/vtb-giai-trinh-chenh-lech-kqkd-quy-4-2025-so-voi-cung-ky-nam-truoc-737-1394121.htm,VTB: Giải trình chênh lệch KQKD quý 4/2025 so với cùng kỳ năm trước,2026-01-22T16:35:05
LPT,https://vietstock.vn/2025/09/lpt-ngay-dang-ky-cuoi-cung-tra-co-tuc-bang-tien-mat-737-1349009.htm,LPT: Ngày đăng ký cuối cùng trả cổ tức bằng tiền mặt,2025-09-04T13:58:00
LNC,https://vietstock.vn/2025/09/lnc-ngay-dang-ky-cuoi-cung-tra-co-tuc-bang-tien-mat-737-1354663.htm,LNC: Ngày đăng ký cuối cùng trả cổ tức bằng tiền mặt,2025-09-23T10:04:00
VCI,https://vietstock.vn/2026/04/vci-dieu-le-cong-ty-737-1422558.htm,VCI: Điều lệ công ty,2026-04-03T14:30:20
SMC,https://vietstock.vn/2026/04/smc-muon-huy-dong-550-ty-dong-tu-phat-hanh-co-phieu-764-1423020.htm,SMC muốn huy động 550 tỷ đồng từ phát hành cổ phiếu,2026-04-04T13:02:00
CHC,https://vietstock.vn/2025/11/chc-thay-doi-giay-dang-ky-kinh-doanh-737-1374342.htm,CHC: Thay đổi giấy đăng ký kinh doanh,2025-11-21T15:36:00
EVF,https://vietstock.vn/2026/03/evf-nghi-quyet-hdqt-ve-viec-phe-duyet-phuong-an-phat-hanh-trai-phieu-tang-von-cap-2-theo-hinh-thuc-rieng-le-nam-2026-737-1411063.htm,EVF: Nghị quyết HĐQT về việc phê duyệt phương án phát hành Trái phiếu tăng vốn cấp 2 theo hình thức riêng lẻ năm 2026,2026-03-11T17:03:55
CTD,https://vietstock.vn/2026/02/chu-tich-bolat-duisenov-coteccons-tien-phong-dua-so-hoa-vao-van-hanh-thuc-te-trong-xay-dung-737-1404402.htm,Chủ tịch Bolat Duisenov: Coteccons tiên phong đưa số hóa vào vận hành thực tế trong xây dựng,2026-02-16T19:13:59.46
HEJ,https://vietstock.vn/2026/01/hej-tang-tran-phien-dau-nam-2026-co-dong-lon-moi-tiep-tuc-gom-them-co-phieu-739-1387596.htm,"HEJ tăng trần phiên đầu năm 2026, cổ đông lớn mới tiếp tục gom thêm cổ phiếu",2026-01-05T12:00:00
MNB,https://vietstock.vn/2026/02/mnb-bao-cao-tai-chinh-quy-4-2025-737-1400783.htm,MNB: Báo cáo tài chính quý 4/2025,2026-02-05T10:32:00
NO1,https://vietstock.vn/2026/01/no1-bctc-hop-nhat-quy-4-nam-2025-737-1397828.htm,NO1: BCTC Hợp nhất quý 4 năm 2025 ,2026-01-30T00:00:00
VTJ,https://vietstock.vn/2025/11/vtj-bao-cao-tai-chinh-quy-3-2025-cong-ty-me-737-1371969.htm,VTJ: Báo cáo tài chính quý 3/2025 (công ty mẹ),2025-11-13T16:40:00
PGB,https://vietstock.vn/2026/03/pgb-quyet-dinh-cua-ngan-hang-nha-nuoc-ve-viec-sua-noi-dung-ve-von-dieu-le-tai-giay-phep-thanh-lap-va-hoat-dong-737-1410679.htm,PGB: Quyết định của Ngân hàng Nhà nước về việc sửa nội dung về vốn điều lệ tại Giấy phép thành lập và hoạt động,2026-03-11T09:32:00
DTT,https://vietstock.vn/2026/01/dtt-bctc-tom-tat-quy-4-nam-2025-737-1393091.htm,DTT: BCTC Tóm tắt quý 4 năm 2025 ,2026-01-20T00:00:00
WSB,https://vietstock.vn/2026/02/wsb-nghi-quyet-hoi-dong-quan-tri-737-1402467.htm,WSB: Nghị quyết Hội đồng quản trị,2026-02-10T15:55:00
SGI,https://vietstock.vn/2026/02/sgi-thong-bao-thay-doi-nhan-su-thanh-vien-hoi-dong-quan-tri-nhiem-ky-2024-2029-214-1402312.htm,SGI: Thông báo thay đổi nhân sự Thành viên Hội đồng quản trị nhiệm kỳ 2024 - 2029,2026-02-10T13:59:00
NUE,https://vietstock.vn/2025/07/nue-bao-cao-quan-tri-cong-ty-ban-nien-2025-737-1332944.htm,NUE: Báo cáo quản trị công ty bán niên 2025,2025-07-25T17:08:00
ITC,https://vietstock.vn/2026/02/bao-nhieu-doanh-nghiep-bat-dong-san-nha-o-can-dich-loi-nhuan-2025-737-1402811.htm,Bao nhiêu doanh nghiệp bất động sản nhà ở cán đích lợi nhuận 2025?,2026-02-21T10:02:00
HHP,https://vietstock.vn/2026/01/hhp-bctc-quy-4-nam-2025-737-1397369.htm,HHP: BCTC quý 4 năm 2025 ,2026-01-29T00:00:00
PVB,https://vietstock.vn/2025/11/pvb-nghi-quyet-hoi-dong-quan-tri-737-1373459.htm,PVB: Nghị quyết Hội đồng quản trị,2025-11-19T10:07:00
BWE,https://vietstock.vn/2026/03/bwe-duong-dan-dang-tai-bao-cao-phat-trien-ben-vung-nam-2025-830-1413247.htm,BWE: Đường dẫn đăng tải Báo cáo phát triển bền vững năm 2025,2026-03-17T16:46:30
KST,https://vietstock.vn/2026/01/kst-bao-cao-tai-chinh-quy-4-2025-737-1396458.htm,KST: Báo cáo tài chính quý 4/2025,2026-01-28T17:40:00
BID,https://vietstock.vn/2026/03/bid-thong-bao-cong-van-cua-ubcknn-ve-bao-cao-ket-qua-dot-chao-ban-co-phieu-rieng-le-cua-bid-739-1419073.htm,BID: Thông báo công văn của UBCKNN về báo cáo kết quả đợt chào bán cổ phiếu riêng lẻ của BID,2026-03-30T16:24:35
NST,https://vietstock.vn/2026/02/nst-nghi-quyet-hoi-dong-quan-tri-quy-i-nam-2026-737-1399329.htm,NST: Nghị quyết Hội đồng quản trị Quý I năm 2026,2026-02-02T14:00:00
CK8,https://vietstock.vn/2025/12/ck8-nguyen-thi-hong-hanh-khong-con-la-co-dong-lon-739-1381250.htm,CK8: Nguyễn Thị Hồng Hạnh không còn là cổ đông lớn,2025-12-15T15:40:00
NAB,https://vietstock.vn/2026/04/co-phieu-ngan-hang-nao-thoat-lua-trung-dong-830-1423566.htm,Cổ phiếu ngân hàng nào “thoát lửa” Trung Đông?,2026-04-06T20:02:00
BMC,https://vietstock.vn/2025/10/bmc-bc-dhdcd-bat-thuong-2025-737-1362401.htm,BMC: BC ĐHĐCĐ bất thường 2025,2025-10-17T14:17:02
SZB,https://vietstock.vn/2026/03/szb-thay-doi-nhan-su-214-1408610.htm,SZB: Thay đổi nhân sự,2026-03-05T14:52:00
DHM,https://vietstock.vn/2026/03/dhm-thong-bao-don-xin-tu-nhiem-cua-thanh-vien-hdqt-214-1408310.htm,DHM: Thông báo đơn xin từ nhiệm của Thành viên HĐQT,2026-03-04T17:26:23
VRG,https://vietstock.vn/2026/02/no-vay-doanh-nghiep-bat-dong-san-tren-san-len-gan-400-ngan-ty-dong-trong-nam-2025-737-1403939.htm,Nợ vay doanh nghiệp bất động sản trên sàn lên gần 400 ngàn tỷ đồng trong năm 2025,2026-02-24T10:02:00
CFM,https://vietstock.vn/2026/01/cfm-quyet-dinh-chap-thuan-thay-doi-dang-ky-giao-dich-co-phieu-cong-ty-co-phan-dau-tu-cfm-737-1393185.htm,CFM: Quyết định chấp thuận thay đổi đăng ký giao dịch cổ phiếu Công ty cổ phần Đầu tư CFM,2026-01-21T08:47:00
HPG,https://vietstock.vn/2026/03/hpg-nghi-quyet-hdqt-so-04-ngay-27-03-2026-737-1417996.htm,HPG: Nghị quyết HĐQT số 04 ngày 27/03/2026,2026-03-27T18:18:55
VPW,https://vietstock.vn/2025/11/vpw-ong-nguyen-manh-cuong-la-nguoi-uy-quyen-thuc-hien-cong-bo-thong-tin-214-1373744.htm,VPW: Ông Nguyễn Mạnh Cường là người ủy quyền thực hiện công bố thông tin,2025-11-19T17:47:00
VCP,https://vietstock.vn/2026/02/vcp-dinh-chinh-bao-cao-tai-chinh-quy-4-2025-cua-cong-ty-me-737-1399959.htm,VCP: Đính chính Báo cáo tài chính quý 4/ 2025 của công ty mẹ,2026-02-03T18:13:00
DND,https://vietstock.vn/2026/03/dnd-tai-lieu-hop-dai-hoi-dong-co-dong-737-1415578.htm,DND: Tài liệu họp Đại hội đồng cổ đông,2026-03-24T14:05:00
PGT,https://vietstock.vn/2026/02/pgt-bao-cao-tai-chinh-quy-4-2025-cong-ty-me-737-1400994.htm,PGT: Báo cáo tài chính quý 4/2025 (công ty mẹ),2026-02-05T14:55:00
IDI,https://vietstock.vn/2026/01/idi-bctc-hop-nhat-quy-4-nam-2025-737-1396900.htm,IDI: BCTC Hợp nhất quý 4 năm 2025 ,2026-01-29T00:00:00
DTG,https://vietstock.vn/2026/02/dtg-ngay-dang-ky-cuoi-cung-dai-hoi-dong-co-dong-thuong-nien-nam-2026-737-1401080.htm,DTG: Ngày đăng ký cuối cùng Đại hội đồng cổ đông thường niên năm 2026,2026-02-05T17:09:00
HPI,https://vietstock.vn/2026/02/cua-de-danh-doanh-nghiep-bat-dong-san-tang-60-trong-nam-2025-737-1404929.htm,Của để dành doanh nghiệp bất động sản tăng 60% trong năm 2025,2026-02-25T11:02:00
SJG,https://vietstock.vn/2025/11/sjg-bao-cao-tai-chinh-quy-3-2025-cong-ty-me-737-1368731.htm,SJG: Báo cáo tài chính quý 3/2025 (công ty mẹ),2025-11-03T13:56:00
DAC,https://vietstock.vn/2025/08/dac-bao-cao-quan-tri-cong-ty-ban-nien-2025-737-1344691.htm,DAC: Báo cáo quản trị công ty bán niên 2025,2025-08-22T15:19:00
GGG,https://vietstock.vn/2026/01/ggg-tran-tan-hong-cuong-uy-vien-hdqt-da-mua-400000-cp-739-1390287.htm,"GGG: Trần Tấn Hồng Cương - Ủy viên HĐQT - đã mua 400,000 CP",2026-01-13T09:28:00
