symbol,valid_url,title,publish_time
TCB,https://vietstock.vn/2026/04/tcb-quyet-dinh-cua-hdqt-ve-viec-phe-duyet-thay-doi-dia-diem-chi-nhanh-ha-noi-737-1423461.htm,TCB: Quyết định của HĐQT về việc phê duyệt thay đổi địa điểm chi nhánh Hà Nội,2026-04-06T15:15:46
VGI,https://vietstock.vn/2026/03/vgi-thong-bao-ngay-dang-ky-cuoi-cung-de-thuc-hien-quyen-tham-du-dai-hoi-dong-co-dong-thuong-nien-2026-737-1409796.htm,VGI: Thông báo ngày đăng ký cuối cùng để thực hiện quyền tham dự Đại hội đồng cổ đông thường niên 2026,2026-03-09T12:10:00
AGM,https://vietstock.vn/2026/03/agm-thong-bao-thay-doi-nguoi-co-lien-quan-cua-nguoi-noi-bo-739-1416414.htm,AGM: Thông báo thay đổi Người có liên quan của Người nội bộ,2026-03-25T17:19:00
DMS,https://vietstock.vn/2025/11/dms-ong-hoang-nam-long-duoc-bau-giu-chuc-chu-tich-hoi-dong-quan-tri-thay-ong-dang-trung-hieu-214-1368911.htm,DMS: Ông Hoàng Nam Long được bầu giữ chức Chủ tịch Hội đồng quản trị thay Ông Đặng Trung Hiếu,2025-11-03T16:40:00
BKC,https://vietstock.vn/2026/02/bkc-bao-cao-tai-chinh-quy-4-2025-cong-ty-me-737-1399323.htm,BKC: Báo cáo tài chính quý 4/2025 (công ty mẹ),2026-02-02T14:06:00
VGS,https://vietstock.vn/2026/03/vgs-thong-bao-ve-ngay-dang-ky-cuoi-cung-de-thuc-hien-quyen-dai-hoi-dong-co-dong-thuong-nien-nam-2026-737-1408248.htm,VGS: Thông báo về ngày đăng ký cuối cùng để thực hiện quyền đại hội đồng cổ đông thường niên năm 2026,2026-03-04T10:41:00
POB,https://vietstock.vn/2025/11/pob-tai-lieu-hop-dai-hoi-dong-co-dong-737-1375555.htm,POB: Tài liệu họp Đại hội đồng cổ đông,2025-11-26T09:09:00
VNG,https://vietstock.vn/2026/03/vng-thong-bao-ve-ngay-dang-ky-cuoi-cung-tham-du-dhdcd-thuong-nien-nam-tai-chinh-2025-737-1413508.htm,VNG: Thông báo về ngày đăng ký cuối cùng tham dự ĐHĐCĐ thường niên năm tài chính 2025,2026-03-18T13:56:36
PVL,https://vietstock.vn/2026/02/no-vay-doanh-nghiep-bat-dong-san-tren-san-len-gan-400-ngan-ty-dong-trong-nam-2025-737-1403939.htm,Nợ vay doanh nghiệp bất động sản trên sàn lên gần 400 ngàn tỷ đồng trong năm 2025,2026-02-24T10:02:00
ACE,https://vietstock.vn/2025/12/ace-nghi-quyet-hoi-dong-quan-tri-737-1386329.htm,ACE: Nghị quyết Hội đồng quản trị,2025-12-30T14:52:00
IDC,https://vietstock.vn/2026/02/no-vay-doanh-nghiep-bat-dong-san-tren-san-len-gan-400-ngan-ty-dong-trong-nam-2025-737-1403939.htm,Nợ vay doanh nghiệp bất động sản trên sàn lên gần 400 ngàn tỷ đồng trong năm 2025,2026-02-24T10:02:00
VLG,https://vietstock.vn/2026/01/vlg-giao-nhiem-vu-cho-ba-vu-doan-tuyet-ngan-phu-trach-ke-toan-cong-ty-214-1393286.htm,VLG: Giao nhiệm vụ cho Bà Vũ Đoàn Tuyết Ngân phụ trách Kế toán Công ty,2026-01-21T10:18:00
TRV,https://vietstock.vn/2025/12/trv-bo-nhiem-ong-do-anh-hung-giu-chuc-vu-pho-tong-giam-doc-214-1378218.htm,TRV: Bổ nhiệm Ông Đỗ Anh Hùng giữ chức vụ Phó Tổng giám đốc,2025-12-03T17:19:00
PVO,https://vietstock.vn/2025/11/pvo-bo-nhiem-ong-luu-van-truy-tiep-tuc-giu-chuc-pho-giam-doc-cong-ty-214-1375231.htm,PVO: Bổ nhiệm Ông Lưu Văn Truy tiếp tục giữ chức Phó Giám đốc Công ty,2025-11-25T13:27:00
GTD,https://vietstock.vn/2026/04/gtd-thong-bao-ve-viec-cong-ty-khong-dap-ung-du-dieu-kien-la-cong-ty-dai-chung-830-1425031.htm,GTD: Thông báo về việc Công ty không đáp ứng đủ điều kiện là công ty đại chúng,2026-04-08T16:13:00
NTT,https://vietstock.vn/2025/12/ntt-nghi-quyet-hoi-dong-quan-tri-737-1378152.htm,NTT: Nghị quyết Hội đồng quản trị,2025-12-03T16:23:00
BSD,https://vietstock.vn/2025/09/bsd-ky-hop-dong-kiem-toan-bao-cao-tai-chinh-nam-2025-737-1356520.htm,BSD: Ký hợp đồng kiểm toán báo cáo tài chính năm 2025,2025-09-29T16:19:00
IJC,https://vietstock.vn/2026/03/ijc-tai-lieu-hop-dhdcd-thuong-nien-nam-2026-737-1414331.htm,IJC: Tài liệu họp ĐHĐCĐ thường niên năm 2026,2026-03-20T09:21:31
KOS,https://vietstock.vn/2026/01/kos-thong-bao-thay-doi-giay-chung-nhan-dang-ky-dn-lan-thu-20-va-gxn-830-1392458.htm,KOS: Thông báo thay đổi giấy chứng nhận đăng ký DN lần thứ 20 và GXN,2026-01-19T18:15:00
CCM,https://vietstock.vn/2025/07/ccm-bao-cao-quan-tri-cong-ty-ban-nien-2025-737-1328806.htm,CCM: Báo cáo quản trị công ty bán niên 2025,2025-07-16T15:50:00
THT,https://vietstock.vn/2025/12/tht-thay-doi-giay-dang-ky-kinh-doanh-737-1381243.htm,THT: Thay đổi giấy đăng ký kinh doanh,2025-12-15T15:34:00
MGC,https://vietstock.vn/2025/12/mgc-nghi-quyet-hoi-dong-quan-tri-737-1381581.htm,MGC: Nghị quyết Hội đồng quản trị,2025-12-16T13:48:00
VMT,https://vietstock.vn/2026/02/vmt-tai-lieu-hop-dai-hoi-dong-co-dong-737-1403120.htm,VMT: Tài liệu họp Đại hội đồng cổ đông,2026-02-11T17:57:00
MHC,https://vietstock.vn/2026/01/mhc-bctc-hop-nhat-quy-4-nam-2025-737-1398502.htm,MHC: BCTC Hợp nhất quý 4 năm 2025 ,2026-01-30T00:00:00
VTD,https://vietstock.vn/2026/03/vtd-thay-doi-nhan-su-214-1410343.htm,VTD: Thay đổi nhân sự,2026-03-10T15:24:00
PGI,https://vietstock.vn/2026/03/pgi-thong-bao-ve-ngay-dang-ky-cuoi-cung-tham-du-dhdcd-thuong-nien-nam-2026-737-1407564.htm,PGI: Thông báo về ngày đăng ký cuối cùng tham dự ĐHĐCĐ thường niên năm 2026,2026-03-03T14:32:03
LMH,https://vietstock.vn/2025/08/lmh-tai-lieu-hop-dai-hoi-dong-co-dong-737-1341295.htm,LMH: Tài liệu họp Đại hội đồng cổ đông,2025-08-14T09:22:00
SBT,https://vietstock.vn/2026/03/sbt-thong-bao-chao-ban-trai-phieu-chuyen-doi-ra-cong-chung-4511-1416795.htm,SBT thông báo chào bán trái phiếu chuyển đổi ra công chúng,2026-03-28T14:02:00
TMW,https://vietstock.vn/2025/11/tmw-nghi-quyet-hdqt-ve-viec-lua-chon-don-vi-kiem-toan-bao-cao-tai-chinh-nam-2025-737-1369330.htm,TMW: Nghị quyết HĐQT về việc lựa chọn đơn vị kiểm toán báo cáo tài chính năm 2025,2025-11-04T16:15:00
LLM,https://vietstock.vn/2025/10/llm-bo-nhiem-ong-to-phi-son-giu-chuc-vu-ke-toan-truong-nhiem-ky-2025-2030-214-1366185.htm,LLM: Bổ nhiệm Ông Tô Phi Sơn giữ chức vụ Kế toán trưởng nhiệm kỳ 2025 - 2030,2025-10-28T12:03:00
NBW,https://vietstock.vn/2026/01/nbw-bao-cao-tai-chinh-quy-4-2025-737-1394642.htm,NBW: Báo cáo tài chính quý 4/2025,2026-01-23T17:06:00
HPO,https://vietstock.vn/2025/11/hpo-ky-hop-dong-kiem-toan-bao-cao-tai-chinh-nam-2025-737-1375234.htm,HPO: Ký hợp đồng kiểm toán báo cáo tài chính năm 2025,2025-11-25T13:28:00
KSQ,https://vietstock.vn/2025/12/ksq-nguyen-thi-phuong-thuy-thu-ky-cong-ty-nguoi-phu-trach-quan-tri-cong-ty-dang-ky-ban-702000-cp-739-1379970.htm,"KSQ: Nguyễn Thị Phương Thúy - Thư ký công ty, Người phụ trách quản trị công ty - đăng ký bán 702,000 CP",2025-12-10T15:25:00
BTU,https://vietstock.vn/2025/08/btu-dieu-chinh-bao-cao-tai-chinh-nam-2024-theo-thong-bao-cua-kiem-toan-nha-nuoc-khu-vuc-ix-737-1340104.htm,BTU: Điều chỉnh Báo cáo tài chính năm 2024 theo thông báo của Kiểm toán nhà nước khu vực IX,2025-08-11T15:45:00
HSV,https://vietstock.vn/2026/03/hsv-bao-cao-thay-doi-so-huu-co-phieu-cua-co-dong-lon-le-thi-hang-739-1409084.htm,HSV: Báo cáo thay đổi sở hữu cổ phiếu của cổ đông lớn - Lê Thị Hằng,2026-03-06T13:33:00
PXT,https://vietstock.vn/2026/01/pxt-bo-nhiem-chuc-vu-pho-giam-doc-cong-ty-doi-voi-ong-pham-duc-khanh-va-ong-nguyen-xuan-bac-214-1397060.htm,PXT: Bổ nhiệm chức vụ Phó Giám đốc Công ty đối với Ông Phạm Đức Khánh và Ông Nguyễn Xuân Bắc,2026-01-29T20:09:00
VXT,https://vietstock.vn/2026/01/vxt-bao-cao-ket-qua-giao-dich-cua-ong-nguyen-tuong-huy-pho-tong-giam-doc-con-cua-ong-nguyen-van-xuan-chu-tich-hdqt-739-1390258.htm,"VXT: Báo cáo kết quả giao dịch của Ông Nguyễn Tường Huy - Phó Tổng Giám đốc, con của Ông Nguyễn Vạn Xuân, Chủ tịch HĐQT",2026-01-13T08:40:00
ANV,https://vietstock.vn/2026/01/lanh-dao-nam-viet-ban-co-phieu-khi-thi-gia-len-dinh-739-1396672.htm,Lãnh đạo Nam Việt bán cổ phiếu khi thị giá lên đỉnh,2026-01-29T14:02:00
TNV,https://vietstock.vn/2026/02/tnv-tai-lieu-hop-dai-hoi-dong-co-dong-737-1400796.htm,TNV: Tài liệu họp Đại hội đồng cổ đông,2026-02-05T10:51:00
CST,https://vietstock.vn/2025/12/cst-nghi-quyet-hoi-dong-quan-tri-737-1379909.htm,CST: Nghị quyết Hội đồng quản trị,2025-12-10T11:02:00
HVX,https://vietstock.vn/2026/02/hvx-thong-bao-thay-doi-nhan-su-hoi-dong-quan-tri-nhiem-ky-2023-2028-214-1403953.htm,HVX: Thông báo thay đổi nhân sự Hội đồng quản trị nhiệm kỳ 2023 - 2028,2026-02-13T15:40:43
TAW,https://vietstock.vn/2026/02/taw-bao-cao-quan-tri-cong-ty-nam-2025-737-1398337.htm,TAW: Báo cáo quản trị công ty năm 2025,2026-02-01T18:08:00
NT2,https://vietstock.vn/2026/02/nt2-nghi-quyet-hdqt-ve-viec-trieu-tap-hop-dhdcd-thuong-nien-nam-2026-737-1406067.htm,NT2: Nghị quyết HĐQT về việc triệu tập họp ĐHĐCĐ thường niên năm 2026,2026-02-26T18:04:00
MWG,https://vietstock.vn/2026/03/phan-tich-ky-thuat-phien-chieu-2303-dieu-chinh-manh-585-1415026.htm,Phân tích kỹ thuật phiên chiều 23/03: Điều chỉnh mạnh,2026-03-23T13:10:11.82
WSS,https://vietstock.vn/2026/03/wss-thay-doi-nhan-su-cong-ty-214-1407844.htm,WSS: Thay đổi nhân sự Công ty,2026-03-03T00:00:00
CFV,https://vietstock.vn/2025/08/cfv-bao-cao-tai-chinh-ban-nien-nam-2025-737-1341301.htm,CFV: Báo cáo tài chính bán niên năm 2025,2025-08-14T09:25:00
HWS,https://vietstock.vn/2026/01/hws-bao-cao-tai-chinh-quy-4-2025-737-1392559.htm,HWS: Báo cáo tài chính quý 4/2025,2026-01-20T09:28:00
SSN,https://vietstock.vn/2025/06/ssn-cbtt-nhan-duoc-don-tu-nhiem-cua-ong-nguyen-quoc-cuong-thanh-vien-bks-214-1318969.htm,SSN: CBTT nhận được Đơn từ nhiệm của Ông Nguyễn Quốc Cường - Thành viên BKS,2025-06-17T16:53:00
TNA,https://vietstock.vn/2026/02/tna-bao-cao-tai-chinh-quy-4-2025-737-1399376.htm,TNA: Báo cáo tài chính quý 4/2025,2026-02-03T08:02:00
TNG,https://vietstock.vn/2026/03/tng-tai-lieu-hop-dai-hoi-dong-co-dong-737-1416712.htm,TNG: Tài liệu họp Đại hội đồng cổ đông,2026-03-26T09:52:00
SJM,https://vietstock.vn/2026/03/sjm-bao-cao-thay-doi-so-huu-co-phieu-cua-co-dong-lon-trinh-thi-quyen-739-1407490.htm,SJM: Báo cáo thay đổi sở hữu cổ phiếu của cổ đông lớn - Trịnh Thị Quyên,2026-03-03T11:19:00
FOX,https://vietstock.vn/2026/03/fox-thong-bao-ve-ngay-dang-ky-cuoi-cung-de-thuc-hien-quyen-tham-du-hop-dhdcd-thuong-nien-nam-2026-737-1406979.htm,FOX: Thông báo về ngày đăng ký cuối cùng để thực hiện quyền tham dự họp ĐHĐCĐ thường niên năm 2026,2026-03-02T13:54:00
GEX,https://vietstock.vn/2026/04/gex-cbtt-cac-bao-cao-dinh-ky-ve-trai-phieu-rdoanh-nghiep-785-1420384.htm,GEX: CBTT các báo cáo định kỳ về trái phiếu rdoanh nghiệp,2026-04-01T10:02:01
MDA,https://vietstock.vn/2026/03/mda-cong-bo-thong-tin-chot-danh-sach-co-dong-thuc-hien-quyen-tham-du-hop-dai-hoi-dong-co-dong-thuong-nien-nam-2026-737-1409908.htm,MDA: Công bố thông tin chốt danh sách cổ đông thực hiện quyền tham dự họp Đại hội đồng cổ đông thường niên năm 2026,2026-03-09T15:19:00
HDW,https://vietstock.vn/2025/08/hdw-bao-cao-tai-chinh-ban-nien-nam-2025-737-1341876.htm,HDW: Báo cáo tài chính bán niên năm 2025,2025-08-15T10:31:00
IDP,https://vietstock.vn/2026/03/idp-don-xin-tu-nhiem-830-1409216.htm,IDP: Đơn xin từ nhiệm,2026-03-06T15:30:00
PEQ,https://vietstock.vn/2026/02/peq-nghi-quyet-hoi-dong-quan-tri-737-1402380.htm,PEQ: Nghị quyết Hội đồng quản trị,2026-02-10T14:53:00
DTE,https://vietstock.vn/2025/05/dte-bao-cao-quan-tri-cong-ty-nam-2024-737-1308960.htm,DTE: Báo cáo quản trị công ty năm 2024,2025-05-15T16:04:00
EME,https://vietstock.vn/2025/07/eme-thong-bao-va-quyet-dinh-lien-quan-den-trang-thai-co-phieu-eme-830-1327466.htm,EME: Thông báo và Quyết định liên quan đến trạng thái cổ phiếu EME,2025-07-11T17:12:00
IRC,https://vietstock.vn/2026/01/irc-bao-cao-tai-chinh-quy-4-2025-737-1392683.htm,IRC: Báo cáo tài chính quý 4/2025,2026-01-20T12:18:00
VNL,https://vietstock.vn/2026/02/vnl-dinh-chinh-noi-dung-dieu-3-cua-nghi-quyet-hdqt-so-115-ngay-25-02-2026-737-1405828.htm,VNL: Đính chính nội dung điều 3 của Nghị quyết HĐQT số 115 ngày 25/02/2026,2026-02-26T14:32:11
CAD,https://vietstock.vn/2025/07/cad-bao-cao-tai-chinh-quy-2-2025-737-1331798.htm,CAD: Báo cáo tài chính quý 2/2025,2025-07-23T17:37:00
KHP,https://vietstock.vn/2026/03/khp-quyet-dinh-cua-hdqt-ve-viec-giao-dich-voi-cong-ty-dien-luc-khanh-hoa-830-1418000.htm,KHP: Quyết định của HĐQT về việc giao dịch với Công ty Điện lực Khánh Hòa,2026-03-27T18:18:55
PVV,https://vietstock.vn/2026/02/pvv-nghi-quyet-hoi-dong-quan-tri-737-1406635.htm,PVV: Nghị quyết Hội đồng quản trị,2026-02-27T18:28:00
PSH,https://vietstock.vn/2025/11/psh-bao-cao-tai-chinh-quy-3-2025-737-1369928.htm,PSH: Báo cáo tài chính quý 3/2025,2025-11-06T09:28:00
PTP,https://vietstock.vn/2025/08/ptp-bao-cao-quan-tri-cong-ty-ban-nien-2025-737-1338216.htm,PTP: Báo cáo quản trị công ty bán niên 2025,2025-08-05T13:32:00
VKC,https://vietstock.vn/2026/01/vkc-bao-cao-tai-chinh-quy-4-2025-737-1393903.htm,VKC: Báo cáo tài chính quý 4/2025,2026-01-22T11:19:00
HTN,https://vietstock.vn/2026/01/htn-giai-trinh-chenh-lech-lnst-quy-4-2025-so-voi-cung-ky-nam-truoc-830-1397948.htm,HTN: Giải trình chênh lệch LNST quý 4/2025 so với cùng kỳ năm trước,2026-01-30T18:52:57
TCL,https://vietstock.vn/2026/01/tcl-bctc-quy-4-nam-2025-737-1392353.htm,TCL: BCTC quý 4 năm 2025 ,2026-01-19T00:00:00
IME,https://vietstock.vn/2025/10/ime-thong-bao-ty-le-so-huu-nuoc-ngoai-toi-da-50-739-1363347.htm,IME: Thông báo tỷ lệ sở hữu nước ngoài tối đa (50%),2025-10-20T19:17:00
VIC,https://vietstock.vn/2026/04/vingroup-tang-toc-tai-an-do-nham-he-sinh-thai-65-ty-usd-737-1426528.htm,"Vingroup tăng tốc tại Ấn Độ, nhắm hệ sinh thái 6.5 tỷ USD",2026-04-11T11:38:42.05
REE,https://vietstock.vn/2026/03/thanh-vien-doc-lap-khang-dinh-ree-co-loi-the-canh-tranh-manh-truoc-bien-dong-nang-luong-737-1419708.htm,Thành viên độc lập khẳng định REE có lợi thế cạnh tranh mạnh trước biến động năng lượng,2026-03-31T17:06:00.587
TUG,https://vietstock.vn/2025/11/tug-bao-cao-tien-do-su-dung-tien-thu-duoc-tu-dot-chao-ban-739-1376102.htm,TUG: Báo cáo tiến độ sử dụng tiền thu được từ đợt chào bán,2025-11-27T16:03:00
TNT,https://vietstock.vn/2026/03/tnt-bao-cao-thuong-nien-nam-2025-737-1414098.htm,TNT: Báo cáo thường niên năm 2025,2026-03-19T16:13:19
BCC,https://vietstock.vn/2026/03/bcc-bao-cao-tai-chinh-nam-2025-737-1412656.htm,BCC: Báo cáo tài chính năm 2025,2026-03-16T15:44:00
KDM,https://vietstock.vn/2026/02/kdm-bao-cao-quan-tri-cong-ty-nam-2025-737-1399198.htm,KDM: Báo cáo quản trị công ty năm 2025,2026-02-02T16:57:00
FDC,https://vietstock.vn/2026/01/hoan-nhap-du-phong-180-ty-trong-quy-4-fdc-bao-lai-cao-nhat-12-nam-737-1394428.htm,"Hoàn nhập dự phòng 180 tỷ trong quý 4, FDC báo lãi cao nhất 12 năm",2026-01-23T15:00:00
LEC,https://vietstock.vn/2026/02/lec-bao-cao-tai-chinh-quy-4-2025-cong-ty-me-737-1399718.htm,LEC: Báo cáo tài chính quý 4/2025 (công ty mẹ),2026-02-03T15:33:00
SCC,https://vietstock.vn/2025/07/scc-bao-cao-quan-tri-cong-ty-ban-nien-2025-737-1333617.htm,SCC: Báo cáo quản trị công ty bán niên 2025,2025-07-28T16:06:00
DST,https://vietstock.vn/2026/01/dst-bao-cao-tai-chinh-quy-4-2025-737-1393674.htm,DST: Báo cáo tài chính quý 4/2025,2026-01-21T17:38:00
HLB,https://vietstock.vn/2026/01/hlb-bao-cao-quan-tri-cong-ty-nam-2025-737-1395128.htm,HLB: Báo cáo quản trị công ty năm 2025,2026-01-26T15:40:00
PTT,https://vietstock.vn/2026/02/ptt-dinh-chinh-thay-doi-ngay-dang-ky-cuoi-cung-de-chot-danh-sach-co-dong-de-to-chuc-hop-dai-hoi-dong-co-dong-thuong-nien-nam-2026-737-1402482.htm,PTT: Đính chính thay đổi ngày đăng ký cuối cùng để chốt danh sách cổ đông để tổ chức họp đại hội đồng cổ đông thường niên năm 2026,2026-02-09T16:20:00
VCM,https://vietstock.vn/2026/02/vcm-ong-nguyen-vu-thien-la-nguoi-uy-quyen-thuc-hien-cong-bo-thong-tin-214-1401906.htm,VCM: Ông Nguyễn Vũ Thiện là người ủy quyền thực hiện công bố thông tin,2026-02-09T15:37:00
CCP,https://vietstock.vn/2025/07/ccp-thay-doi-thong-tin-dia-chi-cong-ty-830-1325644.htm,CCP: Thay đổi thông tin địa chỉ Công ty,2025-07-07T15:32:00
VCX,https://vietstock.vn/2026/01/vcx-bao-cao-tai-chinh-quy-4-2025-737-1392790.htm,VCX: Báo cáo tài chính quý 4/2025,2026-01-20T15:14:00
BT1,https://vietstock.vn/2026/02/bt1-dieu-le-to-chuc-va-hoat-dong-sua-doi-theo-dai-hoi-dong-co-dong-thuong-nien-nam-2025-737-1402468.htm,BT1: Điều lệ tổ chức và hoạt động sửa đổi theo Đại hội đồng cổ đông thường niên năm 2025,2026-02-10T15:56:00
CDC,https://vietstock.vn/2026/03/cdc-thong-bao-ve-ngay-dang-ky-cuoi-cung-to-chuc-dhdcd-thuong-nien-nam-2026-737-1414200.htm,CDC: Thông báo về ngày đăng ký cuối cùng tổ chức ĐHĐCĐ thường niên năm 2026,2026-03-19T17:25:51
DCS,https://vietstock.vn/2026/03/dcs-thong-bao-ngay-dang-ky-cuoi-cung-chot-danh-sach-co-dong-tham-du-dai-hoi-dong-co-dong-thuong-nien-nam-2026-737-1409737.htm,DCS: Thông báo ngày đăng ký cuối cùng chốt danh sách cổ đông tham dự Đại hội đồng cổ đông thường niên năm 2026,2026-03-09T10:34:00
C92,https://vietstock.vn/2025/05/c92-thong-bao-thay-doi-nhan-su-thanh-vien-hoi-dong-quan-tri-va-thanh-vien-ban-kiem-soat-nhiem-ky-2025-2030-214-1305396.htm,C92: Thông báo thay đổi nhân sự Thành viên Hội đồng quản trị và Thành viên Ban kiểm soát nhiệm kỳ 2025 - 2030,2025-05-06T17:00:00
LKW,https://vietstock.vn/2026/03/lkw-tai-lieu-hop-dai-hoi-dong-co-dong-737-1412539.htm,LKW: Tài liệu họp Đại hội đồng cổ đông,2026-03-16T10:50:00
HBH,https://vietstock.vn/2026/01/hbh-bao-cao-tai-chinh-quy-4-2025-737-1394531.htm,HBH: Báo cáo tài chính quý 4/2025,2026-01-23T15:48:00
VFR,https://vietstock.vn/2026/01/vfr-bao-cao-quan-tri-cong-ty-nam-2025-737-1395858.htm,VFR: Báo cáo quản trị công ty năm 2025,2026-01-27T17:27:00
TDP,https://vietstock.vn/2026/03/tdp-quyet-dinh-ve-viec-thay-doi-dang-ky-niem-yet-741-1413867.htm,TDP: Quyết định về việc thay đổi đăng ký niêm yết,2026-03-19T09:35:35
SSB,https://vietstock.vn/2026/04/suc-nong-mua-dhdcd-ngan-hang-2026-cuoc-dua-tang-von-bien-dong-nhan-su-va-tham-gia-vifc-757-1423118.htm,"Sức nóng mùa ĐHĐCĐ ngân hàng 2026: Cuộc đua tăng vốn, biến động nhân sự và tham gia VIFC",2026-04-06T13:02:00
CTF,https://vietstock.vn/2026/01/ctf-bctc-quy-4-nam-2025-737-1398419.htm,CTF: BCTC quý 4 năm 2025 ,2026-01-30T00:00:00
HPT,https://vietstock.vn/2025/10/hpt-van-ban-cua-uy-ban-chung-khoan-nha-nuoc-ve-tai-lieu-bao-cao-ket-qua-dot-phat-hanh-co-phieu-de-tra-co-tuc-738-1361492.htm,HPT: Văn bản của Ủy ban Chứng khoán Nhà nước về tài liệu báo cáo kết quả đợt phát hành cổ phiếu để trả cổ tức,2025-10-15T14:24:00
PHH,https://vietstock.vn/2026/01/phh-bao-cao-tai-chinh-quy-4-2025-737-1395185.htm,PHH: Báo cáo tài chính quý 4/2025,2026-01-26T16:23:00
CNA,https://vietstock.vn/2025/07/cna-bao-cao-quan-tri-cong-ty-ban-nien-2025-737-1333898.htm,CNA: Báo cáo quản trị công ty bán niên 2025,2025-07-29T09:24:00
TPB,https://vietstock.vn/2026/03/tpb-bctc-hop-nhat-nam-2025-737-1419808.htm,TPB: BCTC Hợp nhất năm 2025 ,2026-03-31T00:00:00
HLC,https://vietstock.vn/2026/01/hlc-bao-cao-tai-chinh-quy-4-2025-737-1393728.htm,HLC: Báo cáo tài chính quý 4/2025,2026-01-21T17:29:00
AIC,https://vietstock.vn/2026/02/aic-thay-doi-dia-diem-chi-nhanh-hue-737-1405867.htm,AIC: Thay đổi địa điểm Chi nhánh Huế,2026-02-26T15:11:00
VLB,https://vietstock.vn/2026/01/ong-lon-khai-thac-da-vlb-lai-ky-luc-ke-hoach-2026-di-lui-737-1394128.htm,"Ông lớn khai thác đá VLB lãi kỷ lục, kế hoạch 2026 đi lùi",2026-01-23T10:59:39.42
DOC,https://vietstock.vn/2026/02/doc-cong-bo-thong-tin-ve-viec-thay-doi-mau-dau-cong-ty-830-1401958.htm,DOC: Công bố thông tin về việc Thay đổi Mẫu Dấu công ty,2026-02-09T15:55:00
PVC,https://vietstock.vn/2026/03/pvc-thong-bao-ngay-dang-ky-cuoi-cung-chot-danh-sach-co-dong-tham-du-dai-hoi-dong-co-dong-thuong-nien-2026-737-1406888.htm,PVC: Thông báo ngày đăng ký cuối cùng chốt danh sách cổ đông tham dự Đại hội đồng cổ đông thường niên 2026,2026-03-02T10:28:00
VHM,https://vietstock.vn/2026/03/vn-index-bat-tang-sau-3-tuan-giam-sau-ngan-hang-va-vhm-dan-dat-830-1418145.htm,"VN-Index bật tăng sau 3 tuần giảm sâu, ngân hàng và VHM dẫn dắt",2026-03-28T20:02:00
PTV,https://vietstock.vn/2026/01/ptv-bao-cao-tai-chinh-quy-4-2025-cong-ty-me-737-1391661.htm,PTV: Báo cáo tài chính quý 4/2025 (công ty mẹ),2026-01-16T16:54:00
SAM,https://vietstock.vn/2026/03/sam-cbtt-ky-hop-dong-vay-voi-cong-ty-con-830-1414567.htm,SAM: CBTT ký hợp đồng vay với công ty con,2026-03-20T17:32:31
SPV,https://vietstock.vn/2026/02/spv-tai-lieu-hop-dai-hoi-dong-co-dong-737-1402379.htm,SPV: Tài liệu họp Đại hội đồng cổ đông,2026-02-10T14:52:00
VTH,https://vietstock.vn/2026/02/vth-bao-cao-ket-qua-phat-hanh-830-1402042.htm,VTH: Báo cáo kết quả phát hành,2026-02-09T16:51:00
VE9,https://vietstock.vn/2025/10/ve9-bao-cao-tai-chinh-quy-3-2025-737-1363951.htm,VE9: Báo cáo tài chính quý 3/2025,2025-10-21T17:59:00
KCB,https://vietstock.vn/2025/07/kcb-bao-cao-thay-doi-so-huu-co-phieu-cua-co-dong-lon-dinh-huy-chien-739-1330308.htm,KCB: Báo cáo thay đổi sở hữu cổ phiếu của cổ đông lớn - Đinh Huy Chiến,2025-07-21T14:01:00
TTB,https://vietstock.vn/2026/01/ttb-thong-bao-ve-trang-thai-chung-khoan-cua-co-phieu-ttb-tren-he-thong-giao-dich-upcom-830-1389859.htm,TTB: Thông báo về trạng thái chứng khoán của cổ phiếu TTB trên hệ thống giao dịch UPCoM,2026-01-10T16:18:00
QCC,https://vietstock.vn/2026/01/qcc-nghi-quyet-dai-hoi-dong-co-dong-bat-thuong-nam-2025-737-1396633.htm,QCC: Nghị quyết Đại hội đồng cổ đông bất thường năm 2025,2026-01-29T10:41:00
PMJ,https://vietstock.vn/2025/12/pmj-thong-bao-bo-nhiem-nhan-su-hoi-dong-quan-tri-va-ban-kiem-soat-nhiem-ky-2025-2030-214-1386839.htm,PMJ: Thông báo bổ nhiệm nhân sự Hội đồng quản trị và Ban kiểm soát nhiệm kỳ 2025 - 2030,2025-12-31T15:03:00
DTA,https://vietstock.vn/2026/02/dta-thong-bao-ve-phat-hanh-co-phieu-de-tra-co-tuc-738-1402827.htm,DTA: Thông báo về phát hành cổ phiếu để trả cổ tức,2026-02-11T13:28:33
TBD,https://vietstock.vn/2026/02/tbd-thong-bao-ngay-dang-ky-cuoi-cung-de-thuc-hien-quyen-du-hop-dai-hoi-dong-co-dong-thuong-nien-2026-737-1402942.htm,TBD: Thông báo ngày đăng ký cuối cùng để thực hiện quyền dự họp đại hội đồng cổ đông thường niên 2026,2026-02-11T09:21:00
TSB,https://vietstock.vn/2026/01/tsb-bao-cao-tai-chinh-quy-4-2025-737-1395152.htm,TSB: Báo cáo tài chính quý 4/2025,2026-01-26T16:00:00
NLS,https://vietstock.vn/2025/08/nls-nong-thi-hong-nhung-uy-vien-hdqt-da-mua-29000-cp-739-1346601.htm,"NLS: Nông Thị Hồng Nhung - Ủy viên HĐQT - đã mua 29,000 CP",2025-08-28T10:59:00
CII,https://vietstock.vn/2026/04/cii-thu-moi-va-duong-dan-tai-lieu-hop-dhdcd-thuong-nien-nam-2025-737-1423796.htm,CII: Thư mời và đường dẫn tài liệu họp ĐHĐCĐ thường niên năm 2025,2026-04-07T09:00:30
TMT,https://vietstock.vn/2026/01/tmt-bctc-quy-4-nam-2025-737-1398049.htm,TMT: BCTC quý 4 năm 2025 ,2026-01-30T00:00:00
HAN,https://vietstock.vn/2025/12/han-chap-thuan-giao-dich-hop-dong-voi-nguoi-co-lien-quan-739-1386293.htm,"HAN: Chấp thuận giao dịch, hợp đồng với người có liên quan",2025-12-30T14:25:00
DDM,https://vietstock.vn/2026/02/ddm-thong-bao-ve-ngay-dang-ky-cuoi-cung-de-chot-danh-sach-co-dong-tham-dụ-dhdcd-thuòng-nien-nam-2026-737-1401472.htm,DDM: Thông báo về ngày đăng ký cuối cùng để chốt danh sách cổ đông tham dự ĐHĐCĐ thường niên năm 2026,2026-02-06T16:20:00
DSE,https://vietstock.vn/2026/03/dse-thong-bao-dinh-chinh-ngay-dkcc-lap-ds-nguoi-so-huu-trai-phieu-739-1418680.htm,DSE: Thông báo đính chính ngày ĐKCC lập DS người sở hữu trái phiếu,2026-03-30T14:29:58
NET,https://vietstock.vn/2026/01/net-bao-cao-tai-chinh-quy-4-2025-737-1393157.htm,NET: Báo cáo tài chính quý 4/2025,2026-01-21T07:46:00
SGH,https://vietstock.vn/2025/08/sgh-ky-hop-dong-kiem-toan-2025-737-1344198.htm,SGH: Ký Hợp đồng kiểm toán 2025,2025-08-21T13:55:00
L45,https://vietstock.vn/2025/04/l45-nghi-quyet-dai-hoi-dong-co-dong-thuong-nien-nam-2025-737-1298147.htm,L45: Nghị quyết Đại hội đồng cổ đông thường niên năm 2025,2025-04-19T22:32:00
TOT,https://vietstock.vn/2026/03/tot-giay-chung-nhan-dang-ky-dia-diem-kinh-doanh-tai-khu-cong-nghiep-loc-an-binh-son-830-1408059.htm,TOT: Giấy chứng nhận đăng ký địa điểm kinh doanh tại Khu công nghiệp Lộc An - Bình Sơn,2026-03-04T13:48:00
DNA,https://vietstock.vn/2026/01/dna-ngay-dang-ky-cuoi-cung-lay-y-kien-co-dong-bang-van-ban-737-1395623.htm,DNA: Ngày đăng ký cuối cùng lấy ý kiến cổ đông bằng văn bản,2026-01-27T14:47:00
