symbol,valid_url,title,publish_time
NVT,https://vietstock.vn/2026/01/nvt-giai-trinh-noi-dung-lien-quan-den-bctc-quy-4-2025-737-1398110.htm,NVT: Giải trình nội dung liên quan đến BCTC quý 4/2025,2026-01-30T19:59:45
TLG,https://vietstock.vn/2026/03/tlg-nghi-quyet-hdqt-ve-viec-thong-qua-giao-dich-voi-cac-ben-lien-quan-737-1414124.htm,TLG: Nghị quyết HĐQT về việc thông qua giao dịch với các bên liên quan,2026-03-19T16:33:31
VTS,https://vietstock.vn/2025/08/vts-thong-bao-thanh-lý-tài-sản-có-dịnh-của-chi-nhánh-cong-ty-nha-may-hải-duong-737-1345543.htm,VTS: Thông báo thanh lý tài sản cố định của Chi nhánh Công ty - Nhà máy Hải Dương,2025-08-25T17:49:00
CSM,https://vietstock.vn/2026/01/csm-bao-cao-tinh-hinh-quan-tri-cong-ty-nam-2025-737-1397476.htm,CSM: Báo cáo tình hình quản trị công ty năm 2025,2026-01-30T14:53:21
BDT,https://vietstock.vn/2025/11/bdt-dinh-chinh-tai-lieu-dinh-kem-bien-ban-va-nghi-quyet-dai-hoi-dong-co-dong-bat-thuong-lan-3-nam-2025-737-1370694.htm,BDT: Đính chính tài liệu đính kèm biên bản và Nghị quyết đại hội đồng cổ đông bất thường lần 3 năm 2025,2025-11-10T10:26:00
FCC,https://vietstock.vn/2026/03/fcc-thong-bao-ve-viec-huy-tu-cach-cong-ty-dai-chung-doi-voi-cong-ty-co-phan-lien-hop-thuc-pham-830-1416294.htm,FCC: Thông báo về việc hủy tư cách công ty đại chúng đối với công ty cổ phần Liên hợp thực phẩm,2026-03-25T16:27:00
MEC,https://vietstock.vn/2025/09/mec-nguyen-viet-dung-uy-vien-hdqt-da-mua-1000000-cp-739-1354739.htm,"MEC: Nguyễn Việt Dũng - Ủy viên HĐQT - đã mua 1,000,000 CP",2025-09-23T15:12:00
SPM,https://vietstock.vn/2025/11/spm-thong-bao-ngay-dkcc-de-thuc-hien-quyen-chi-tra-co-tuc-nam-2024-738-1370132.htm,SPM: Thông báo ngày ĐKCC để thực hiện quyền chi trả cổ tức năm 2024,2025-11-06T16:58:23
PPT,https://vietstock.vn/2026/01/ppt-bao-cao-tai-chinh-quy-4-2025-737-1392920.htm,PPT: Báo cáo tài chính quý 4/2025,2026-01-20T17:00:00
BCF,https://vietstock.vn/2026/02/bcf-nghi-quyet-hoi-dong-quan-tri-737-1399962.htm,BCF: Nghị quyết Hội đồng quản trị,2026-02-03T15:54:00
VAB,https://vietstock.vn/2026/03/vab-bctc-hop-nhat-nam-2025-737-1420773.htm,VAB: BCTC Hợp nhất năm 2025 ,2026-03-30T00:00:00
L62,https://vietstock.vn/2025/06/l62-tai-lieu-hop-dai-hoi-dong-co-dong-737-1317461.htm,L62: Tài liệu họp Đại hội đồng cổ đông,2025-06-12T10:45:00
PPE,https://vietstock.vn/2026/02/ppe-bao-cao-tai-chinh-quy-4-2025-737-1399311.htm,PPE: Báo cáo tài chính quý 4/2025,2026-02-02T14:39:00
TOS,https://vietstock.vn/2026/01/tos-nghi-quyet-hdqt-thong-qua-cac-hop-dong-giao-dich-voi-ben-co-lien-quan-737-1395096.htm,"TOS: Nghị quyết HĐQT thông qua các hợp đồng, giao dịch với bên có liên quan",2026-01-26T15:25:00
TA6,https://vietstock.vn/2025/12/ta6-ky-hop-dong-kiem-toan-bao-cao-tai-chinh-nam-2025-737-1378160.htm,TA6: Ký hợp đồng kiểm toán Báo cáo tài chính năm 2025,2025-12-03T16:33:00
QNU,https://vietstock.vn/2025/11/qnu-thay-doi-giay-dang-ky-kinh-doanh-737-1369673.htm,QNU: Thay đổi giấy đăng ký kinh doanh,2025-11-05T13:41:00
DPR,https://vietstock.vn/2026/01/dpr-giai-trinh-kqkd-hn-va-rieng-quy-4-2025-so-voi-cung-ky-nam-truoc-737-1396410.htm,DPR: Giải trình KQKD HN và Riêng quý 4/2025 so với cùng kỳ năm trước,2026-01-28T17:27:42
KBC,https://vietstock.vn/2026/03/kbc-giai-trinh-bien-dong-lnst-nam-2025-da-kiem-toan-so-voi-cung-ky-nam-truoc-737-1413271.htm,KBC: Giải trình biến động LNST năm 2025 đã kiểm toán so với cùng kỳ năm trước,2026-03-17T17:15:17
PDN,https://vietstock.vn/2026/03/pdn-bctc-nam-2025-737-1412729.htm,PDN: BCTC năm 2025 ,2026-03-16T00:00:00
BTP,https://vietstock.vn/2025/11/btp-cbtt-chot-dscd-de-chi-co-tuc-nam-2024-bang-tien-mat-mat-738-1368999.htm,BTP: CBTT chốt DSCĐ để chi cổ tức năm 2024 bằng tiền mặt mặt,2025-11-03T17:37:01
VE3,https://vietstock.vn/2026/01/mot-ca-nhan-rot-von-giup-ve3-co-cau-no-ngan-hang-739-1388502.htm,Một cá nhân rót vốn giúp VE3 cơ cấu nợ ngân hàng,2026-01-07T12:08:59.827
HHV,https://vietstock.vn/2026/03/hhv-bctc-nam-2025-737-1420020.htm,HHV: BCTC năm 2025 ,2026-03-31T00:00:00
BBM,https://vietstock.vn/2026/01/bbm-thong-bao-thay-doi-nhan-su-vi-tri-pho-giam-doc-va-ke-toan-truong-cong-ty-214-1387748.htm,BBM: Thông báo thay đổi nhân sự vị trí Phó Giám đốc và Kế toán trưởng Công ty,2026-01-05T15:06:00
ILC,https://vietstock.vn/2026/02/ilc-bao-cao-quan-tri-cong-ty-nam-2025-737-1400634.htm,ILC: Báo cáo quản trị công ty năm 2025,2026-02-04T18:37:00
CTX,https://vietstock.vn/2026/02/no-vay-doanh-nghiep-bat-dong-san-tren-san-len-gan-400-ngan-ty-dong-trong-nam-2025-737-1403939.htm,Nợ vay doanh nghiệp bất động sản trên sàn lên gần 400 ngàn tỷ đồng trong năm 2025,2026-02-24T10:02:00
PPP,https://vietstock.vn/2026/02/ppp-bao-cao-tai-chinh-quy-4-2025-737-1399457.htm,PPP: Báo cáo tài chính quý 4/2025,2026-02-03T10:12:00
VND,https://vietstock.vn/2026/03/vnd-thong-bao-quyet-dinh-cua-ubcknn-ve-viec-sua-doi-qd-chap-thuan-thanh-lap-cn-da-nang-830-1417480.htm,VND: Thông báo Quyết định của UBCKNN về việc sửa đổi QĐ chấp thuận thành lập CN Đà Nẵng,2026-03-27T14:06:51
SED,https://vietstock.vn/2025/10/sed-bao-cao-thay-doi-so-huu-co-phieu-cua-co-dong-lon-cong-ty-co-phan-dau-tu-cmc-737-1364811.htm,SED: Báo cáo thay đổi sở hữu cổ phiếu của cổ đông lớn - Công ty cổ phần đầu tư CMC,2025-10-23T17:35:00
PEN,https://vietstock.vn/2026/02/pen-ngay-dang-ky-cuoi-cung-thuc-hien-quyen-tham-du-dai-hoi-dong-co-dong-nam-2026-737-1402954.htm,PEN: Ngày đăng ký cuối cùng thực hiện quyền tham dự đại hội đồng cổ đông năm 2026,2026-02-10T16:25:00
SHS,https://vietstock.vn/2026/04/shs-cbtt-quyet-dinh-cua-hdqt-ve-viec-thong-qua-giao-dich-giua-shs-va-shb-trong-quy-ii-830-1424280.htm,SHS: CBTT Quyết định của HĐQT về việc thông qua giao dịch giữa SHS và SHB trong quý II,2026-04-07T16:32:00
HMD,https://vietstock.vn/2025/09/hmd-quyet-dinh-chap-thuan-dang-ky-giao-dich-bo-sung-741-1356372.htm,HMD: Quyết định chấp thuận đăng ký giao dịch bổ sung,2025-09-29T10:26:00
RCL,https://vietstock.vn/2025/11/no-vay-doanh-nghiep-bat-dong-san-tren-san-tang-37-so-voi-dau-nam-737-1373458.htm,Nợ vay doanh nghiệp bất động sản trên sàn tăng 37% so với đầu năm,2025-11-24T11:02:00
PMS,https://vietstock.vn/2026/03/pms-tai-lieu-hop-dai-hoi-dong-co-dong-737-1411600.htm,PMS: Tài liệu họp Đại hội đồng cổ đông,2026-03-12T16:56:00
AGR,https://vietstock.vn/2026/03/agr-agr-bao-cao-thuong-nien-nam-2025-cua-agriseco-the-annual-report-2025-of-agriseco-737-1413481.htm,AGR: AGR - Báo cáo thường niên năm 2025 của Agriseco/ The Annual Report 2025 of Agriseco,2026-03-18T00:00:00
VVS,https://vietstock.vn/2026/03/vvs-dinh-chinh-giay-chung-nhan-dang-ky-dau-tu-ma-du-an-1005066222-737-1417087.htm,VVS: Đính chính Giấy chứng nhận đăng ký đầu tư mã dự án 1005066222,2026-03-26T17:20:30
LGC,https://vietstock.vn/2026/01/cii-hoan-tat-chuyen-nhuong-27-trieu-cp-lgc-cho-cong-ty-chau-739-1392064.htm,CII hoàn tất chuyển nhượng 2.7 triệu cp LGC cho công ty 'cháu',2026-01-19T12:15:00
SHB,https://vietstock.vn/2026/04/shs-cbtt-quyet-dinh-cua-hdqt-ve-viec-thong-qua-giao-dich-giua-shs-va-shb-trong-quy-ii-830-1424280.htm,SHS: CBTT Quyết định của HĐQT về việc thông qua giao dịch giữa SHS và SHB trong quý II,2026-04-07T16:32:00
KHW,https://vietstock.vn/2026/01/khw-dinh-chinh-bao-cao-tai-chinh-quy-4-2025-737-1395415.htm,KHW: Đính chính Báo cáo tài chính quý  4/ 2025,2026-01-27T09:22:00
VOS,https://vietstock.vn/2026/03/vos-bctc-nam-2025-737-1408278.htm,VOS: BCTC năm 2025 ,2026-03-04T00:00:00
SD5,https://vietstock.vn/2026/01/sd5-ngay-dang-ky-cuoi-cung-tra-co-tuc-bang-tien-mat-737-1389852.htm,SD5: Ngày đăng ký cuối cùng trả cổ tức bằng tiền mặt,2026-01-10T15:39:00
VE8,https://vietstock.vn/2025/04/ve8-giai-trinh-co-phieu-ve8-giam-san-5-phien-lien-tiep-830-1300087.htm,VE8: Giải trình cổ phiếu VE8 giảm sàn 5 phiên liên tiếp,2025-04-23T14:42:00
PFL,https://vietstock.vn/2026/01/pfl-bao-cao-tai-chinh-quy-4-2025-737-1393986.htm,PFL: Báo cáo tài chính quý 4/2025,2026-01-22T15:03:00
BSG,https://vietstock.vn/2025/12/bsg-thong-bao-thay-doi-nhan-su-can-bo-chu-chot-cong-ty-214-1386362.htm,"BSG: Thông báo thay đổi nhân sự, cán bộ chủ chốt Công ty",2025-12-30T15:22:00
NXT,https://vietstock.vn/2025/07/nxt-nghi-quyet-dai-hoi-dong-co-dong-thuong-nien-nam-2025-737-1333903.htm,NXT: Nghị quyết Đại hội đồng cổ đông thường niên năm 2025,2025-07-29T09:24:00
DPM,https://vietstock.vn/2026/03/dpm-san-luong-ure-quy-1-vuot-ke-hoach-25-san-sang-don-co-hoi-xuat-khau-118-1413803.htm,"DPM: Sản lượng ure quý 1 vượt kế hoạch 25%, sẵn sàng đón cơ hội xuất khẩu",2026-03-18T21:19:11.237
TTC,https://vietstock.vn/2026/01/ttc-bao-cao-tai-chinh-quy-4-2025-737-1393256.htm,TTC: Báo cáo tài chính quý 4/2025,2026-01-21T10:03:00
TSA,https://vietstock.vn/2026/01/tsa-bctc-quy-4-nam-2025-737-1393407.htm,TSA: BCTC quý 4 năm 2025 ,2026-01-20T00:00:00
HPD,https://vietstock.vn/2026/01/hpd-bao-cao-quan-tri-cong-ty-nam-2025-737-1392895.htm,HPD: Báo cáo quản trị công ty năm 2025,2026-01-20T16:41:00
TCW,https://vietstock.vn/2026/03/tcw-dinh-chinh-bao-cao-quan-tri-cong-ty-nam-2024-737-1407381.htm,TCW: Đính chính Báo cáo quản trị công ty năm 2024,2026-03-03T09:35:00
VBB,https://vietstock.vn/2026/04/hose-nhan-duoc-ho-so-dang-ky-niem-yet-11-ty-cp-vbb-741-1422278.htm,HOSE nhận được hồ sơ đăng ký niêm yết 1.1 tỷ cp VBB,2026-04-03T09:51:56.473
TAL,https://vietstock.vn/2026/03/tal-giai-trinh-bien-dong-kqkd-kiem-toan-nam-2025-so-voi-cung-ky-nam-truoc-737-1419889.htm,TAL: Giải trình biến động KQKD kiểm toán năm 2025 so với cùng kỳ năm trước,2026-03-31T17:11:15
DHB,https://vietstock.vn/2026/01/dhb-bao-cao-tai-chinh-quy-4-2025-737-1393493.htm,DHB: Báo cáo tài chính quý 4/2025,2026-01-21T15:27:00
PTM,https://vietstock.vn/2026/04/ptm-nghi-quyet-hoi-dong-quan-tri-737-1421101.htm,PTM: Nghị Quyết Hội đồng Quản trị,2026-04-01T17:05:00
ABB,https://vietstock.vn/2026/04/co-phieu-ngan-hang-nao-thoat-lua-trung-dong-830-1423566.htm,Cổ phiếu ngân hàng nào “thoát lửa” Trung Đông?,2026-04-06T20:02:00
LIX,https://vietstock.vn/2026/02/lix-cbtt-ket-qua-sxkd-quy-4-2025-va-ca-nam-2025-ke-hoach-kinh-doanh-quy-1-2026-737-1402494.htm,LIX: CBTT kết quả SXKD quý 4/2025 và cả năm 2025. kế hoạch kinh doanh quý 1/2026,2026-02-10T16:16:33
SKV,https://vietstock.vn/2026/03/skv-thong-bao-ngay-dang-ky-cuoi-cung-du-kien-de-thuc-hien-quyen-tham-du-dai-hoi-dong-co-dong-thuong-nien-nam-tai-chinh-2025-737-1408217.htm,SKV: Thông báo ngày đăng ký cuối cùng dự kiến để thực hiện quyền tham dự đại hội đồng cổ đông thường niên năm tài chính 2025,2026-03-03T16:24:00
TXM,https://vietstock.vn/2026/02/txm-ngay-dang-ky-cuoi-cung-de-tham-du-dai-hoi-dong-co-dong-thuong-nien-nam-2026-737-1400397.htm,TXM: Ngày đăng ký cuối cùng để tham dự Đại hội đồng cổ đông thường niên năm 2026,2026-02-04T15:34:00
TTS,https://vietstock.vn/2026/01/tts-bao-cao-quan-tri-cong-ty-nam-2025-737-1396278.htm,TTS: Báo cáo quản trị công ty năm 2025,2026-01-28T15:59:00
MSN,https://vietstock.vn/2026/03/mang-tieu-dung-8211-ban-le-khoi-sac-masan-ky-vong-dot-pha-loi-nhuan-2026-737-1413978.htm,"Mảng tiêu dùng – bán lẻ khởi sắc, Masan kỳ vọng đột phá lợi nhuận 2026",2026-03-19T14:17:00
SBG,https://vietstock.vn/2026/01/sbg-bctc-quy-4-nam-2025-737-1397936.htm,SBG: BCTC quý 4 năm 2025 ,2026-01-30T00:00:00
HAX,https://vietstock.vn/2026/02/hax-nghi-quyet-hdqt-ve-viec-thong-qua-tai-lieu-hop-dhdcd-thuong-nien-nam-2026-737-1406571.htm,HAX: Nghị quyết HĐQT về việc thông qua tài liệu họp ĐHĐCĐ thường niên năm 2026,2026-02-27T17:34:38
EFI,https://vietstock.vn/2025/05/efi-thong-bao-thay-doi-nhan-su-thanh-vien-hoi-dong-quan-tri-cong-ty-214-1304716.htm,EFI: Thông báo thay đổi nhân sự Thành viên Hội đồng quản trị Công ty,2025-05-05T15:26:00
TTN,https://vietstock.vn/2026/01/ttn-bao-cao-tai-chinh-quy-4-2025-cong-ty-me-737-1397610.htm,TTN: Báo cáo tài chính quý 4/2025 (công ty mẹ),2026-01-30T16:30:00
DAT,https://vietstock.vn/2026/01/dat-thong-bao-thay-doi-mau-dau-cong-ty-830-1392715.htm,DAT: Thông báo thay đổi mẫu dấu công ty,2026-01-20T13:42:41
LMI,https://vietstock.vn/2025/12/lmi-nghi-quyet-hoi-dong-quan-tri-737-1387041.htm,LMI: Nghị quyết Hội đồng quản trị,2025-12-31T16:30:00
SEB,https://vietstock.vn/2026/02/seb-ngay-dang-ky-cuoi-cung-dai-hoi-dong-co-dong-thuong-nien-nam-2026-737-1402552.htm,SEB: Ngày đăng ký cuối cùng Đại hội đồng cổ đông thường niên năm 2026,2026-02-10T16:57:00
ICG,https://vietstock.vn/2026/01/dau-tu-gan-100-ty-icg-thu-ve-co-tuc-tien-mat-hon-36-ty-738-1387745.htm,"Đầu tư gần 100 tỷ, ICG thu về cổ tức tiền mặt hơn 36 tỷ",2026-01-05T16:31:39.26
HES,https://vietstock.vn/2026/03/hes-nhan-don-tu-nhiem-chuc-vu-pho-ct-hdqt-tvhdqt-tvbks-830-1411971.htm,"HES: Nhận đơn từ nhiệm Chức vụ Phó CT HĐQT, TVHĐQT, TVBKS",2026-03-13T14:33:00
HU4,https://vietstock.vn/2026/01/hu4-bao-cao-tai-chinh-quy-4-2025-737-1393735.htm,HU4: Báo cáo tài chính quý 4/2025,2026-01-21T18:46:00
CNC,https://vietstock.vn/2025/08/ct3-bao-cao-ve-thay-doi-so-huu-cua-ong-vuong-tan-hat-va-to-chuc-co-lien-quan-la-cong-ty-tnhh-dau-tu-xay-dung-thuong-mai-san-xuat-cnc-737-1344633.htm,CT3: Báo cáo về thay đổi sở hữu của Ông Vương Tấn Hát và tổ chức có liên quan là Công ty TNHH Đầu tư - Xây Dựng - Thương mại - Sản xuất CNC,2025-08-22T14:25:00
LM7,https://vietstock.vn/2025/12/lm7-cong-bo-thong-tin-ve-viec-ban-dau-gia-tai-san-739-1381709.htm,LM7: Công bố thông tin về việc bán đấu giá tài sản,2025-12-16T16:28:00
RDP,https://vietstock.vn/2025/05/rang-dong-holding-khong-con-hold-737-1304435.htm,Rạng Đông Holding không còn “hold”?,2025-05-05T13:02:00
KSB,https://vietstock.vn/2026/01/ksb-bctc-hop-nhat-quy-4-nam-2025-737-1396377.htm,KSB: BCTC Hợp nhất quý 4 năm 2025 ,2026-01-28T00:00:00
HUT,https://vietstock.vn/2026/03/loat-doanh-nghiep-dia-oc-cong-bo-du-an-dau-nam-2026-4222-1409809.htm,Loạt doanh nghiệp địa ốc công bố dự án đầu năm 2026,2026-03-10T09:26:49.973
BPC,https://vietstock.vn/2026/01/bpc-bao-cao-quan-tri-cong-ty-nam-2025-737-1396659.htm,BPC: Báo cáo quản trị công ty năm 2025,2026-01-29T11:04:00
LCM,https://vietstock.vn/2026/03/lcm-nghi-quyet-hoi-dong-quan-tri-737-1415780.htm,LCM: Nghị quyết Hội đồng quản trị,2026-03-24T16:25:00
DXP,https://vietstock.vn/2025/10/dxp-bao-cao-tai-chinh-quy-3-2025-cong-ty-me-737-1367256.htm,DXP: Báo cáo tài chính quý 3/2025 (công ty mẹ),2025-10-30T10:45:00
CT3,https://vietstock.vn/2025/12/ct3-le-thi-xao-pho-giam-doc-ke-toan-truong-dang-ky-mua-250000-cp-739-1386309.htm,"CT3: Lê Thị Xảo - Phó Giám đốc, Kế toán trưởng - đăng ký mua 250,000 CP",2025-12-30T14:31:00
NAS,https://vietstock.vn/2025/10/nas-thay-doi-giay-dang-ky-kinh-doanh-737-1357742.htm,NAS: Thay đổi giấy đăng ký kinh doanh,2025-10-02T15:12:00
DAN,https://vietstock.vn/2026/02/dan-nghi-quyet-hoi-dong-quan-tri-737-1404650.htm,DAN: Nghị quyết Hội đồng quản trị,2026-02-23T14:28:00
SPD,https://vietstock.vn/2026/02/spd-bao-cao-quan-tri-cong-ty-nam-2025-737-1401221.htm,SPD: Báo cáo quản trị công ty năm 2025,2026-02-06T09:33:00
CQT,https://vietstock.vn/2025/07/cqt-bao-cao-quan-tri-cong-ty-ban-nien-2025-737-1334064.htm,CQT: Báo cáo quản trị công ty bán niên 2025,2025-07-29T13:49:00
PJC,https://vietstock.vn/2026/02/pjc-nghi-quyet-hoi-dong-quan-tri-737-1400539.htm,PJC: Nghị quyết Hội đồng quản trị,2026-02-04T16:24:00
BCB,https://vietstock.vn/2025/09/bcb-tran-thi-thu-huong-uy-vien-hdqt-da-ban-8000-cp-739-1352775.htm,"BCB: Trần Thị Thu Hường - Ủy viên HĐQT - đã bán 8,000 CP",2025-09-16T14:59:00
TDS,https://vietstock.vn/2026/02/tds-bao-cao-quan-tri-cong-ty-nam-2025-737-1398316.htm,TDS: Báo cáo quản trị công ty năm 2025,2026-02-01T16:18:00
HNG,https://vietstock.vn/2026/03/hng-thong-bao-ve-ngay-dang-ky-cuoi-cung-chot-danh-sach-co-dong-tham-du-dai-hoi-dong-co-dong-thuong-nien-2026-737-1407498.htm,HNG: Thông báo về ngày đăng ký cuối cùng chốt danh sách cổ đông tham dự Đại hội đồng cổ đông thường niên 2026,2026-03-03T11:17:00
SDY,https://vietstock.vn/2025/07/sdy-bao-cao-quan-tri-cong-ty-ban-nien-2025-737-1329633.htm,SDY: Báo cáo quản trị công ty bán niên 2025,2025-07-18T10:10:00
HRB,https://vietstock.vn/2026/02/hrb-tai-lieu-hop-dai-hoi-dong-co-dong-737-1403409.htm,HRB: Tài liệu họp Đại hội đồng cổ đông,2026-02-12T14:53:00
ADG,https://vietstock.vn/2026/02/adg-bao-cao-tinh-hinh-quan-tri-cong-ty-nam-2025-737-1398602.htm,ADG: Báo cáo tình hình quản trị công ty năm 2025,2026-02-02T10:22:29
THU,https://vietstock.vn/2025/08/thu-bo-nhiem-ong-nguyen-the-anh-giu-chuc-vu-ke-toan-truong-thay-cho-ba-le-thi-thu-ha-214-1339097.htm,THU: Bổ nhiệm Ông Nguyễn Thế Anh giữ chức vụ Kế toán trưởng thay cho Bà Lê Thị Thu Hà,2025-08-07T15:08:00
NCG,https://vietstock.vn/2026/01/ncg-nghi-quyet-hoi-dong-quan-tri-737-1387684.htm,NCG: Nghị quyết Hội đồng quản trị,2026-01-05T14:25:00
DS3,https://vietstock.vn/2026/03/ds3-ngay-dang-ky-cuoi-cung-dai-hoi-dong-co-dong-thuong-nien-nam-2026-737-1412016.htm,DS3: Ngày đăng ký cuối cùng Đại hội đồng cổ đông thường niên năm 2026,2026-03-13T15:11:00
VHH,https://vietstock.vn/2025/10/vhh-bo-nhiem-ong-truong-the-son-giu-chuc-vu-pho-tong-giam-doc-214-1360307.htm,VHH: Bổ nhiệm Ông Trương Thế Sơn giữ chức vụ Phó Tổng giám đốc,2025-10-10T15:08:00
BSR,https://vietstock.vn/2026/03/bsr-dat-muc-tieu-doanh-thu-gan-6-ty-usd-nhung-giam-manh-loi-nhuan-737-1415749.htm,BSR đặt mục tiêu doanh thu gần 6 tỷ USD nhưng giảm mạnh lợi nhuận,2026-03-24T17:52:49.03
BDG,https://vietstock.vn/2026/02/bdg-bao-cao-tai-chinh-quy-4-2025-737-1399517.htm,BDG: Báo cáo tài chính quý 4/2025,2026-02-03T11:26:00
UCT,https://vietstock.vn/2025/06/uct-nghi-quyet-dai-hoi-dong-co-dong-thuong-nien-nam-2025-737-1314710.htm,UCT: Nghị quyết Đại hội đồng cổ đông thường niên năm 2025,2025-06-03T16:50:00
SD6,https://vietstock.vn/2025/07/sd6-bao-cao-tai-chinh-quy-2-2025-737-1330873.htm,SD6: Báo cáo tài chính quý 2/2025,2025-07-22T09:23:00
DC2,https://vietstock.vn/2026/02/dc2-bao-cao-thay-doi-so-huu-co-phieu-cua-co-dong-lon-cong-ty-co-phan-d2-capital-739-1399790.htm,DC2: Báo cáo thay đổi sở hữu cổ phiếu của cổ đông lớn - Công ty cổ phần D2 Capital,2026-02-03T16:32:00
CDP,https://vietstock.vn/2026/03/cdp-bao-cao-ket-qua-giao-dich-739-1412115.htm,CDP: Báo cáo kết quả giao dịch,2026-03-13T16:44:00
QST,https://vietstock.vn/2025/07/qst-bao-cao-quan-tri-cong-ty-ban-nien-2025-737-1334817.htm,QST: Báo cáo quản trị công ty bán niên 2025,2025-07-30T14:05:00
VSG,https://vietstock.vn/2026/02/vsg-bao-cao-quan-tri-cong-ty-nam-2025-737-1400843.htm,VSG: Báo cáo quản trị công ty năm 2025,2026-02-05T12:30:00
FCN,https://vietstock.vn/2026/02/fcn-giai-trinh-loi-nhuan-bctc-quy-4-2025-so-voi-cung-ky-nam-truoc-737-1399016.htm,FCN: Giải trình lợi nhuận BCTC quý 4/2025 so với cùng kỳ năm trước,2026-02-02T15:39:00
EIB,https://vietstock.vn/2026/03/eib-giai-trinh-bien-dong-lnst-nam-2025-da-kiem-toan-so-voi-cung-ky-nam-truoc-737-1419224.htm,EIB: Giải trình biến động LNST năm 2025 đã kiểm toán so với cùng kỳ năm trước,2026-03-31T09:10:27
POT,https://vietstock.vn/2026/02/pot-bao-cao-quan-tri-cong-ty-nam-2025-737-1399294.htm,POT: Báo cáo quản trị công ty năm 2025,2026-02-02T15:21:00
RTB,https://vietstock.vn/2026/01/rtb-bao-cao-tai-chinh-quy-4-2025-cong-ty-me-737-1393872.htm,RTB: Báo cáo tài chính quý 4/2025 (công ty mẹ),2026-01-22T10:31:00
CMW,https://vietstock.vn/2025/10/cmw-cong-bo-thong-tin-vè-viẹc-thay-dỏi-ten-dịa-chỉ-và-con-dáu-của-cong-ty-cỏ-phàn-cáp-nuóc-cà-mau-và-các-don-vị-trục-thuọc-cong-ty-theo-dịa-giói-hành-chính-mói-830-1365672.htm,"CMW: Công bố thông tin về việc thay đổi tên, địa chỉ và con dấu của Công ty cổ phần Cấp nước Cà Mau và các đơn vị trực thuộc Công ty theo địa giới hành chính mới",2025-10-27T11:29:00
X20,https://vietstock.vn/2026/01/x20-bao-cao-quan-tri-cong-ty-nam-2025-737-1396996.htm,X20: Báo cáo quản trị công ty năm 2025,2026-01-29T17:38:00
BVS,https://vietstock.vn/2025/11/bvs-nghi-quyet-hoi-dong-quan-tri-737-1368991.htm,BVS: Nghị quyết Hội đồng quản trị,2025-11-03T17:22:00
HD8,https://vietstock.vn/2025/11/hd8-cong-bo-thong-tin-ve-viec-ky-hop-dong-kiem-toan-bao-cao-tai-chinh-nam-2025-737-1371516.htm,HD8: Công bố thông tin về việc ký Hợp đồng kiểm toán Báo cáo tài chính năm 2025,2025-11-12T15:00:00
VPG,https://vietstock.vn/2026/01/vpg-bctc-quy-4-nam-2025-737-1397951.htm,VPG: BCTC quý 4 năm 2025 ,2026-01-30T00:00:00
VTC,https://vietstock.vn/2026/02/vtc-bao-cao-tai-chinh-quy-4-2025-cong-ty-me-737-1400520.htm,VTC: Báo cáo tài chính quý 4/2025 (công ty mẹ),2026-02-04T16:34:00
ECO,https://vietstock.vn/2026/03/eco-nghi-quyet-hoi-dong-quan-tri-737-1412555.htm,ECO: Nghị quyết Hội đồng quản trị,2026-03-16T11:08:00
TNH,https://vietstock.vn/2026/03/tnh-nghi-quyet-hdqt-ve-viec-to-chuc-dhdcd-thuong-nien-nam-2026-737-1409416.htm,TNH: Nghị quyết HĐQT về việc tổ chức ĐHĐCĐ thường niên năm 2026,2026-03-06T17:44:46
DCR,https://vietstock.vn/2026/01/dcr-bao-cao-so-huu-cua-co-dong-lon-vu-tuan-anh-739-1393330.htm,DCR: Báo cáo sở hữu của cổ đông lớn - Vũ Tuấn Anh,2026-01-21T11:21:00
HDM,https://vietstock.vn/2026/01/hdm-bao-cao-tai-chinh-quy-4-2025-737-1394239.htm,HDM: Báo cáo tài chính quý 4/2025,2026-01-22T17:53:00
MDF,https://vietstock.vn/2025/10/mdf-bao-cao-tai-chinh-quy-3-2025-737-1362392.htm,MDF: Báo cáo tài chính quý 3/2025,2025-10-17T14:05:00
PTH,https://vietstock.vn/2025/11/pth-cong-bo-thay-doi-nguoi-co-lien-quan-cua-nguoi-noi-bo-739-1375237.htm,PTH: Công bố thay đổi Người có liên quan của người nội bộ,2025-11-25T13:32:00
MDG,https://vietstock.vn/2026/03/mdg-link-cong-bo-tai-lieu-dhdcd-thuong-nien-2026-737-1407232.htm,MDG: Link công bố tài liệu ĐHĐCĐ thường niên 2026,2026-03-02T17:37:14
PWA,https://vietstock.vn/2026/01/pwa-bao-cao-so-huu-cua-co-dong-lon-le-van-do-739-1392684.htm,PWA: Báo cáo sở hữu của cổ đông lớn - Lê Văn Đô,2026-01-20T12:21:00
VMC,https://vietstock.vn/2026/02/vmc-bao-cao-quan-tri-cong-ty-nam-2025-737-1399861.htm,VMC: Báo cáo quản trị công ty năm 2025,2026-02-03T16:31:00
SBD,https://vietstock.vn/2025/10/sbd-bao-cao-tai-chinh-quy-2-2025-cong-ty-me-737-1362326.htm,SBD: Báo cáo tài chính quý 2/2025 (công ty mẹ),2025-10-17T11:05:00
FIR,https://vietstock.vn/2026/01/fir-bctc-quy-1-nam-2026-737-1398530.htm,FIR: BCTC quý 1 năm 2026 ,2026-01-30T00:00:00
SCS,https://vietstock.vn/2026/02/scs-bao-cao-ket-qua-giao-dich-co-phieu-cua-nguoi-co-lien-quan-den-nguoi-noi-bo-doan-thi-thu-huong-739-1404144.htm,SCS: Báo cáo kết quả giao dịch cổ phiếu của người có liên quan đến người nội bộ Đoàn Thị Thu Hương,2026-02-13T17:08:30
AAA,https://vietstock.vn/2026/01/aaa-bctc-quy-4-nam-2025-737-1396052.htm,AAA: BCTC quý 4 năm 2025 ,2026-01-28T00:00:00
CT6,https://vietstock.vn/2025/09/ct6-phan-hong-ngoc-uy-vien-hdqt-tong-giam-doc-dang-ky-mua-36560-cp-739-1352772.htm,"CT6: Phan Hồng Ngọc - Ủy viên HĐQT, Tổng Giám đốc - đăng ký mua 36,560 CP",2025-09-16T14:51:00
AVC,https://vietstock.vn/2025/12/avc-thong-bao-ngay-dang-ky-cuoi-cung-de-thuc-hien-quyen-nhan-tam-ung-co-tuc-nam-2025-dot-1-737-1380629.htm,AVC: Thông báo ngày đăng ký cuối cùng để thực hiện quyền nhận tạm ứng cổ tức năm 2025 - đợt 1,2025-12-12T10:50:00
CMX,https://vietstock.vn/2026/02/cmx-thong-bao-nhan-duoc-van-ban-cua-vsdc-chap-nhan-cap-nhat-bo-sung-mau-giay-chung-nhan-so-huu-co-phan-739-1401565.htm,CMX: Thông báo nhận được Văn bản của VSDC chấp nhận cập nhật bổ sung mẫu Giấy chứng nhận sở hữu cổ phần,2026-02-06T17:50:21
BVB,https://vietstock.vn/2026/03/lai-suat-tiet-kiem-hap-dan-tro-lai-kich-ban-nao-cho-dong-tien-dau-tu-trong-ngan-han-757-1415546.htm,Lãi suất tiết kiệm hấp dẫn trở lại: Kịch bản nào cho dòng tiền đầu tư trong ngắn hạn?,2026-03-25T09:02:00
GIC,https://vietstock.vn/2026/03/gic-ctcp-container-nguoi-co-lien-quan-thong-bao-thuc-hien-quyen-mua-co-phieu-739-1413234.htm,GIC: CTCP Container - Người có liên quan - Thông báo thực hiện quyền mua cổ phiếu,2026-03-17T16:43:00
BTD,https://vietstock.vn/2025/08/btd-thay-doi-giay-dang-ky-kinh-doanh-737-1345315.htm,BTD: Thay đổi giấy đăng ký kinh doanh,2025-08-25T15:12:00
HEV,https://vietstock.vn/2025/12/hev-thong-bao-thay-doi-so-luong-co-phieu-co-quyen-bieu-quyet-830-1382258.htm,HEV: Thông báo thay đổi số lượng cổ phiếu có quyền biểu quyết,2025-12-17T17:09:00
HDA,https://vietstock.vn/2026/02/hda-bao-cao-tai-chinh-quy-4-2025-cong-ty-me-737-1400018.htm,HDA: Báo cáo tài chính quý 4/2025 (công ty mẹ),2026-02-03T14:07:00
