symbol,valid_url,title,publish_time
TLH,https://vietstock.vn/2026/01/tlh-nghi-quyet-hdqt-ve-viec-giao-dich-voi-cac-ben-co-lien-quan-thuoc-tham-quyen-cua-hdqt-737-1387608.htm,TLH: Nghị quyết HĐQT về việc giao dịch với các bên có liên quan thuộc thẩm quyền của HĐQT,2026-01-05T11:12:16
VCE,https://vietstock.vn/2025/11/vce-ky-hop-dong-kiem-toan-bao-cao-tai-chinh-2025-737-1370029.htm,VCE: Ký hợp đồng kiểm toán Báo cáo tài chính 2025,2025-11-06T14:55:00
SRC,https://vietstock.vn/2026/03/src-nghi-quyet-hdqt-ve-thoi-gian-to-chuc-dhdcd-thuong-nien-nam-2026-737-1407657.htm,SRC: Nghị quyết HĐQT về thời gian tổ chức ĐHĐCĐ thường niên năm 2026,2026-03-03T15:40:49
TIE,https://vietstock.vn/2025/04/tie-nghi-quyet-hoi-dong-quan-tri-737-1303210.htm,TIE: Nghị quyết Hội đồng quản trị,2025-04-29T09:53:00
SCD,https://vietstock.vn/2026/02/scd-cong-bo-thong-tin-nghi-quyet-hdqt-discloses-information-bod-resolution-737-1405047.htm,SCD: Công bố thông tin Nghị quyết HĐQT/ Discloses information BOD Resolution,2026-02-24T14:03:00
C21,https://vietstock.vn/2025/11/c21-bao-cao-tai-chinh-quy-3-2025-cong-ty-me-737-1368792.htm,C21: Báo cáo tài chính quý 3/2025 (công ty mẹ),2025-11-03T15:07:00
TBR,https://vietstock.vn/2025/11/tbr-tai-lieu-hop-dai-hoi-dong-co-dong-737-1369231.htm,TBR: Tài liệu họp Đại hội đồng cổ đông,2025-11-04T12:07:00
SIG,https://vietstock.vn/2025/07/sig-bao-cao-quan-tri-cong-ty-ban-nien-2025-737-1328731.htm,SIG: Báo cáo quản trị công ty bán niên 2025,2025-07-16T14:44:00
L10,https://vietstock.vn/2026/01/l10-bctc-quy-4-nam-2025-737-1392393.htm,L10: BCTC quý 4 năm 2025 ,2026-01-19T00:00:00
VDB,https://vietstock.vn/2025/07/vdb-bao-cao-quan-tri-cong-ty-ban-nien-2025-737-1331467.htm,VDB: Báo cáo quản trị công ty bán niên 2025,2025-07-22T23:45:00
SLD,https://vietstock.vn/2026/02/cua-de-danh-doanh-nghiep-bat-dong-san-tang-60-trong-nam-2025-737-1404929.htm,Của để dành doanh nghiệp bất động sản tăng 60% trong năm 2025,2026-02-25T11:02:00
FCS,https://vietstock.vn/2026/03/fcs-bao-cao-tai-chinh-nam-2025-737-1410144.htm,FCS: Báo cáo tài chính năm 2025,2026-03-09T16:57:00
QBS,https://vietstock.vn/2025/08/qbs-bao-cao-quan-tri-cong-ty-ban-nien-2025-737-1337117.htm,QBS: Báo cáo quản trị công ty bán niên 2025,2025-08-03T23:57:00
CTS,https://vietstock.vn/2026/03/cts-nghi-quyet-hdqt-ve-viec-thay-doi-ten-pgd-ba-trieu-737-1412693.htm,CTS: Nghị quyết HĐQT về việc thay đổi tên PGD Bà Triệu,2026-03-16T16:37:19
CMP,https://vietstock.vn/2025/12/cmp-cong-bo-thong-tin-ve-ty-le-so-huu-nuoc-ngoai-toi-da-tai-cong-ty-739-1386349.htm,CMP: Công bố thông tin về tỷ lệ sở hữu nước ngoài tối đa tại công ty,2025-12-30T15:04:00
VC3,https://vietstock.vn/2026/04/vc3-bao-cao-tai-chinh-nam-2025-cong-ty-me-737-1422466.htm,VC3: Báo cáo tài chính năm 2025 (Công ty mẹ),2026-04-03T11:45:00
ICT,https://vietstock.vn/2026/01/ict-bctc-quy-4-nam-2025-737-1397425.htm,ICT: BCTC quý 4 năm 2025 ,2026-01-30T00:00:00
BHH,https://vietstock.vn/2025/12/bhh-ky-hop-dong-kiem-toan-bao-cao-tai-chinh-nam-2025-737-1377528.htm,BHH: Ký hợp đồng kiểm toán Báo cáo tài chính năm 2025,2025-12-02T10:15:00
SBR,https://vietstock.vn/2025/08/sbr-bao-cao-tai-chinh-ban-nien-nam-2025-737-1342072.htm,SBR: Báo cáo tài chính bán niên năm 2025,2025-08-15T14:45:00
PGN,https://vietstock.vn/2025/12/pgn-vũ-quỳnh-anh-khong-con-la-co-dong-lon-739-1377798.htm,PGN: Vũ Quỳnh Anh không còn là cổ đông lớn,2025-12-02T16:57:00
MQN,https://vietstock.vn/2025/12/mqn-nghi-quyet-hoi-dong-quan-tri-737-1379221.htm,MQN: Nghị quyết Hội đồng quản trị,2025-12-08T11:16:00
HT1,https://vietstock.vn/2026/03/ht1-thong-bao-ve-ngay-dang-ky-cuoi-cung-to-chuc-dhdcd-thuong-nien-nam-2026-737-1410745.htm,HT1: Thông báo về ngày đăng ký cuối cùng tổ chức ĐHĐCĐ thường niên năm 2026,2026-03-11T10:43:41
LSS,https://vietstock.vn/2026/01/lss-bctc-hop-nhat-quy-2-nam-2026-737-1397921.htm,LSS: BCTC Hợp nhất quý 2 năm 2026 ,2026-01-30T00:00:00
PHP,https://vietstock.vn/2026/02/php-nghi-quyet-hoi-dong-quan-tri-737-1403840.htm,PHP: Nghị quyết Hội đồng quản trị,2026-02-13T13:50:00
HJC,https://vietstock.vn/2026/03/hjc-ngay-dang-ky-cuoi-cung-dai-hoi-dong-co-dong-thuong-nien-nam-2026-737-1410913.htm,HJC: Ngày đăng ký cuối cùng Đại hội đồng cổ đông thường niên năm 2026,2026-03-11T15:38:00
VLC,https://vietstock.vn/2026/02/vlc-nghi-quyet-hoi-dong-quan-tri-thong-qua-ke-hoach-to-chuc-dai-hoi-dong-co-dong-thuong-nien-2026-737-1399702.htm,VLC: Nghị quyết Hội đồng quản trị thông qua kế hoạch tổ chức Đại hội đồng cổ đông thường niên 2026,2026-02-03T10:33:00
DAG,https://vietstock.vn/2025/07/dag-giai-trinh-va-dua-ra-phuong-an-khac-phuc-ve-trang-thai-chung-khoan-830-1331309.htm,DAG: Giải trình và đưa ra phương án khắc phục về trạng thái chứng khoán,2025-07-22T16:41:00
CPI,https://vietstock.vn/2026/03/cpi-quyet-dinh-ve-viec-duy-tri-dien-han-che-giao-dich-va-thong-bao-ve-trang-thai-chung-khoan-cua-co-phieu-cpi-830-1407173.htm,CPI: Quyết định về việc duy trì diện hạn chế giao dịch và Thông báo về trạng thái chứng khoán của cổ phiếu CPI,2026-03-02T17:08:00
TRS,https://vietstock.vn/2025/10/trs-ngay-05-11-2025-thong-bao-ngay-giao-dich-cua-co-phieu-dang-ky-giao-dich-bo-sung-741-1366275.htm,"TRS: Ngày 05/11/2025, Thông báo ngày giao dịch của cổ phiếu đăng ký giao dịch bổ sung",2025-10-28T14:53:00
PLX,https://vietstock.vn/2026/03/plx-thong-bao-ve-ngay-dang-ky-cuoi-cung-tham-du-dhdcd-thuong-nien-nam-2026-737-1410357.htm,PLX: Thông báo về ngày đăng ký cuối cùng tham dự ĐHĐCĐ thường niên năm 2026,2026-03-10T15:42:44
SHI,https://vietstock.vn/2026/02/shi-cbtt-ky-ket-hop-dong-hoan-doi-von-gop-shi-va-she-830-1405807.htm,SHI: CBTT ký kết hợp đồng hoán đổi vốn góp SHI và SHE,2026-02-26T14:22:19
SBL,https://vietstock.vn/2026/01/sbl-bao-cao-tai-chinh-quy-4-2025-737-1391595.htm,SBL: Báo cáo tài chính quý 4/2025,2026-01-16T14:58:00
DFC,https://vietstock.vn/2025/10/dfc-phan-tan-binh-chu-tich-hdqt-da-mua-354000-cp-739-1359954.htm,"DFC: Phan Tấn Bình - Chủ tịch HĐQT - đã mua 354,000 CP",2025-10-09T15:28:00
BWS,https://vietstock.vn/2025/11/bws-cong-doan-ctcp-cap-nuoc-ba-ria-vung-tau-cong-doan-da-ban-296800-cp-739-1374894.htm,"BWS: Công đoàn CTCP Cấp nước Bà Rịa - Vũng Tàu - Công đoàn - đã bán 296,800 CP",2025-11-24T14:59:00
TDC,https://vietstock.vn/2026/01/tdc-bctc-quy-4-nam-2025-737-1396798.htm,TDC: BCTC quý 4 năm 2025 ,2026-01-29T00:00:00
PSE,https://vietstock.vn/2026/01/pse-bao-cao-tai-chinh-quy-4-2025-737-1394153.htm,PSE: Báo cáo tài chính quý 4/2025,2026-01-22T16:53:00
QNC,https://vietstock.vn/2026/02/qnc-bao-cao-tai-chinh-quy-4-2025-cong-ty-me-737-1400903.htm,QNC: Báo cáo tài chính quý 4/2025 (công ty mẹ),2026-02-05T14:08:00
VDL,https://vietstock.vn/2025/08/vdl-ngay-dang-ky-cuoi-cung-cho-co-dong-hien-huu-de-thuc-hien-quyen-nhan-co-tuc-2024-bang-tien-mat-737-1343721.htm,VDL: Ngày đăng ký cuối cùng cho cổ đông hiện hữu để thực hiện quyền nhận cổ tức 2024 bằng tiền mặt,2025-08-20T11:21:00
MA1,https://vietstock.vn/2025/06/ma1-ngay-dang-ky-cuoi-cung-tra-co-tuc-bang-tien-mat-737-1321414.htm,MA1: Ngày đăng ký cuối cùng trả cổ tức bằng tiền mặt,2025-06-25T09:54:00
ALC,https://vietstock.vn/2026/01/alc-bao-cao-quan-tri-cong-ty-nam-2025-737-1397541.htm,ALC: Báo cáo quản trị công ty năm 2025,2026-01-30T15:50:00
TSD,https://vietstock.vn/2025/12/tsd-bao-cao-thay-doi-so-huu-co-phieu-cua-co-dong-lon-nguyen-huy-hoang-739-1381554.htm,TSD: Báo cáo thay đổi sở hữu cổ phiếu của cổ đông lớn - Nguyễn Huy Hoàng,2025-12-16T11:13:00
DSP,https://vietstock.vn/2026/01/dsp-nghi-quyet-hoi-dong-quan-tri-737-1391034.htm,DSP: Nghị quyết Hội đồng quản trị,2026-01-15T09:45:00
SGR,https://vietstock.vn/2026/03/sgr-bctc-hop-nhat-nam-2025-737-1415197.htm,SGR: BCTC Hợp nhất năm 2025 ,2026-03-19T00:00:00
CIG,https://vietstock.vn/2026/01/cig-nghi-quyet-hdqt-ve-viec-thong-qua-noi-dung-phien-hop-hdqt-ngay-27-01-2026-737-1396485.htm,CIG: Nghị quyết HĐQT về việc thông qua nội dung phiên họp HĐQT ngày 27/01/2026,2026-01-29T08:19:49
MKP,"https://vietstock.vn/2025/11/mkp-khong-con-cong-ty-con
thay-doi-mo-hinh-cong-ty-va-loai-bao-cao-tai-chinh-737-1370406.htm","MKP: Không còn công ty con,
Thay đổi mô hình công ty và loại báo cáo tài chính",2025-11-07T16:27:00
ONW,https://vietstock.vn/2026/03/onw-thong-bao-thay-doi-so-luong-co-phieu-co-quyen-bieu-quyet-dang-luu-hanh-741-1413053.htm,ONW: Thông báo thay đổi số lượng cổ phiếu có quyền biểu quyết đang lưu hành,2026-03-17T14:19:00
ILS,https://vietstock.vn/2026/03/ils-uy-ban-nhan-dan-thanh-pho-ha-noi-nguoi-co-lien-quan-den-pho-tong-giam-doc;-uy-vien-hdqt-dang-ky-ban-16200000-cp-739-1408527.htm,"ILS: Ủy ban nhân dân Thành phố Hà Nội - người có liên quan đến Phó Tổng Giám đốc; Ủy viên HĐQT - đăng ký bán 16,200,000 CP",2026-03-05T11:05:00
SFG,https://vietstock.vn/2026/02/sfg-thong-bao-ve-viec-trinh-bay-lai-so-lieu-bctc-kiem-toan-2024-theo-ket-luan-cua-kiem-toan-nha-nuoc-737-1405995.htm,SFG: Thông báo về việc trình bày lại số liệu BCTC kiểm toán 2024 theo kết luận của Kiểm toán Nhà nước,2026-02-26T16:18:05
HCM,https://vietstock.vn/2026/04/hcm-bao-cao-thuong-nien-nam-2025-737-1422403.htm,HCM: Báo cáo thường niên năm 2025,2026-04-03T10:43:06
DXS,https://vietstock.vn/2026/01/dxs-bctc-hop-nhat-quy-4-nam-2025-737-1398907.htm,DXS: BCTC Hợp nhất quý 4 năm 2025 ,2026-01-30T00:00:00
DNL,https://vietstock.vn/2025/12/dnl-nghi-quyet-hoi-dong-quan-tri-737-1386337.htm,DNL: Nghị quyết Hội đồng quản trị,2025-12-30T14:56:00
CEO,https://vietstock.vn/2026/03/ceo-ket-qua-to-chuc-dhdcd-thuong-nien-nam-2026-lan-1-khong-thanh-cong-737-1418436.htm,CEO: Kết quả tổ chức ĐHĐCĐ thường niên năm 2026 lần 1 không thành công,2026-03-30T10:20:00
PPS,https://vietstock.vn/2026/02/pps-bao-cao-tai-chinh-quy-4-2025-737-1399217.htm,PPS: Báo cáo tài chính quý 4/2025,2026-02-02T16:59:00
HNP,https://vietstock.vn/2025/12/hnp-thong-bao-ngay-dang-ky-cuoi-cung-de-thuc-hien-quyen-tam-ung-co-tuc-bang-tien-nam-2025-737-1386635.htm,HNP: Thông báo ngày đăng ký cuối cùng để thực hiện quyền tạm ứng cổ tức bằng tiền năm 2025,2025-12-31T10:22:00
VTO,https://vietstock.vn/2026/03/vto-giay-chung-nhan-dang-ky-doanh-nghiep-thay-doi-lan-thu-14-737-1406991.htm,VTO: Giấy chứng nhận đăng ký doanh nghiệp thay đổi lần thứ 14,2026-03-02T13:51:59
DPC,https://vietstock.vn/2026/02/dpc-bao-cao-quan-tri-cong-ty-nam-2025-737-1398741.htm,DPC: Báo cáo quản trị công ty năm 2025,2026-02-02T11:04:00
SHN,https://vietstock.vn/2026/02/shn-thay-doi-giay-dang-ky-kinh-doanh-737-1403752.htm,SHN: Thay đổi giấy đăng ký kinh doanh,2026-02-13T09:39:00
TQN,https://vietstock.vn/2025/05/tqn-nghi-quyet-dai-hoi-dong-co-dong-thuong-nien-nam-2025-737-1307778.htm,TQN: Nghị quyết Đại hội đồng cổ đông thường niên năm 2025,2025-05-12T21:24:00
LQN,https://vietstock.vn/2026/02/lqn-bao-cao-quan-tri-cong-ty-nam-2025-737-1401257.htm,LQN: Báo cáo quản trị công ty năm 2025,2026-02-06T11:01:00
VCS,https://vietstock.vn/2026/02/vcs-bao-cao-tai-chinh-quy-4-2025-737-1399019.htm,VCS: Báo cáo tài chính quý 4/2025,2026-02-02T15:30:00
HSP,https://vietstock.vn/2026/01/hsp-bao-cao-tai-chinh-quy-4-2025-737-1394709.htm,HSP: Báo cáo tài chính quý 4/2025,2026-01-23T17:31:00
STS,https://vietstock.vn/2025/07/sts-bao-cao-quan-tri-cong-ty-ban-nien-2025-737-1330582.htm,STS: Báo cáo quản trị công ty bán niên 2025,2025-07-21T16:34:00
VBC,https://vietstock.vn/2026/01/vbc-bao-cao-quan-tri-cong-ty-nam-2025-737-1392115.htm,VBC: Báo cáo quản trị công ty năm 2025,2026-01-19T11:09:00
HSL,https://vietstock.vn/2026/02/hsl-giai-trinh-bien-dong-lnst-tren-bctc-quy-4-2025-so-voi-cung-ky-nam-truoc-737-1398694.htm,HSL: Giải trình biến động LNST trên BCTC quý 4/2025 so với cùng kỳ năm trước,2026-02-02T11:06:04
ELC,https://vietstock.vn/2026/03/elc-bctc-nam-2025-737-1419154.htm,ELC: BCTC năm 2025 ,2026-03-30T00:00:00
HCT,https://vietstock.vn/2025/10/hct-bao-cao-tai-chinh-quy-3-2025-737-1364762.htm,HCT: Báo cáo tài chính quý 3/2025,2025-10-23T17:20:00
TRC,https://vietstock.vn/2026/01/trc-giai-trinh-chenh-lech-lnst-quy-4-2025-so-voi-cung-ky-nam-truoc-830-1396071.htm,TRC: Giải trình chênh lệch LNST quý 4/2025 so với cùng kỳ năm trước,2026-01-28T11:21:26
MSH,https://vietstock.vn/2026/03/msh-thong-bao-ngay-dkcc-thuc-hien-quyen-tham-du-dhdcd-tn-2026-737-1408882.htm,MSH: Thông báo ngày ĐKCC thực hiện quyền tham dự ĐHĐCĐ TN 2026,2026-03-05T18:15:30
GDT,https://vietstock.vn/2026/02/gdt-quyet-dinh-cua-hdqt-ve-ngay-dang-ky-cuoi-cung-chot-danh-sach-co-dong-tham-du-dhdcd-thuong-nien-nam-tai-chinh-2025-737-1405105.htm,GDT: Quyết định của HĐQT về ngày đăng ký cuối cùng chốt danh sách cổ đông tham dự ĐHĐCĐ thường niên năm tài chính 2025,2026-02-24T15:01:12
SDK,https://vietstock.vn/2025/12/sdk-thay-doi-giay-dang-ky-kinh-doanh-737-1382427.htm,SDK: Thay đổi giấy đăng ký kinh doanh,2025-12-18T10:09:00
CCA,https://vietstock.vn/2025/10/cca-nghi-quyet-hoi-dong-quan-tri-737-1366832.htm,CCA: Nghị quyết Hội đồng quản trị,2025-10-29T16:32:00
HAV,https://vietstock.vn/2025/09/hav-nghi-quyet-dai-hoi-dong-co-dong-thuong-nien-nam-2025-737-1354717.htm,HAV: Nghị quyết Đại hội đồng cổ đông thường niên năm 2025,2025-09-23T14:36:00
G36,https://vietstock.vn/2026/02/g36-bao-cao-tai-chinh-quy-4-2025-cong-ty-me-737-1399529.htm,G36: Báo cáo tài chính quý 4/2025 (công ty mẹ),2026-02-03T11:55:00
MTA,https://vietstock.vn/2025/11/mta-thay-doi-giay-dang-ky-kinh-doanh-737-1373860.htm,MTA: Thay đổi giấy đăng ký kinh doanh,2025-11-20T10:01:00
VNI,https://vietstock.vn/2025/09/vni-nghi-quyet-hdqt-ve-viec-gop-von-thanh-lap-ctcp-cong-di-san-737-1356940.htm,VNI: Nghị quyết HĐQT về việc góp vốn thành lập CTCP Cổng Di Sản,2025-09-30T14:34:00
NAV,https://vietstock.vn/2026/01/nav-thong-bao-nhan-duoc-don-tu-nhiem-truong-ban-kiem-soat-noi-bo-737-1394247.htm,NAV: Thông báo nhận được đơn từ nhiệm Trường ban Kiểm soát nội bộ,2026-01-22T18:00:11
LM8,https://vietstock.vn/2025/12/lm8-nghi-quyet-hdqt-ve-viec-thong-qua-hop-dong-giao-dich-voi-cac-ben-co-lien-quan-nam-2026-737-1384143.htm,"LM8: Nghị quyết HĐQT về việc thông qua hơp đồng, giao dịch với các bên có liên quan năm 2026",2025-12-24T10:54:11
DNT,https://vietstock.vn/2025/12/dnt-bo-nhiem-ong-nguyen-cong-luat-giu-chuc-vu-nguoi-phu-trach-quan-tri-cong-ty-214-1383428.htm,DNT: Bổ nhiệm Ông Nguyễn Công Luật giữ chức vụ người phụ trách quản trị Công ty,2025-12-22T15:39:00
VNP,https://vietstock.vn/2026/01/vnp-bao-cao-tai-chinh-quy-4-2025-737-1395648.htm,VNP: Báo cáo tài chính quý 4/2025,2026-01-27T15:04:00
CRV,https://vietstock.vn/2026/01/crv-giay-chung-nhan-dang-ky-doanh-nghiep-thay-doi-lan-thu-18-737-1396242.htm,CRV: Giấy chứng nhận đăng ký doanh nghiệp thay đổi lần thứ 18,2026-01-28T15:43:06
SSG,https://vietstock.vn/2026/02/ssg-cbtt-don-tu-nhiem-chuc-danh-giam-doc-830-1402350.htm,SSG: CBTT đơn từ nhiệm chức danh giám đốc,2026-02-10T14:34:00
DAH,https://vietstock.vn/2026/03/dah-thong-bao-ve-ngay-dang-ky-cuoi-cung-to-chuc-dhdcd-thuong-nien-nam-2026-737-1411804.htm,DAH: Thông báo về ngày đăng ký cuối cùng tổ chức ĐHĐCĐ thường niên năm 2026,2026-03-13T09:43:44
DVM,https://vietstock.vn/2026/03/dvm-duong-thi-thai-nguoi-duoc-uy-quyen-cong-bo-thong-tin-nguoi-phu-trach-quan-tri-cong-ty-da-mua-2000000-cp-739-1408532.htm,"DVM: Dương Thị Thái - Người được ủy quyền công bố thông tin, Người phụ trách quản trị công ty - đã mua 2,000,000 CP",2026-03-05T11:14:00
SPC,https://vietstock.vn/2026/02/spc-bao-cao-tai-chinh-quy-4-2025-737-1398928.htm,SPC: Báo cáo tài chính quý 4/2025,2026-02-02T14:18:00
SBB,https://vietstock.vn/2026/02/sbb-bao-cao-tai-chinh-quy-4-2025-737-1400752.htm,SBB: Báo cáo tài chính quý 4/2025,2026-02-05T09:41:00
MCG,https://vietstock.vn/2026/03/mcg-bao-cao-tai-chinh-nam-2025-737-1412635.htm,MCG: Báo cáo tài chính năm 2025,2026-03-16T15:13:00
VGR,https://vietstock.vn/2026/03/vgr-tai-lieu-hop-dai-hoi-dong-co-dong-737-1409442.htm,VGR: Tài liệu họp Đại hội đồng cổ đông,2026-03-06T17:58:00
SDU,https://vietstock.vn/2025/11/sdu-tro-lai-mat-dat-trong-quy-3-lai-rong-chua-den-500-trieu-dong-737-1369306.htm,"SDU “trở lại mặt đất” trong quý 3, lãi ròng chưa đến 500 triệu đồng",2025-11-05T09:42:00
HOM,https://vietstock.vn/2026/02/hom-bao-cao-quan-tri-cong-ty-nam-2025-737-1398619.htm,HOM: Báo cáo quản trị công ty năm 2025,2026-02-02T10:25:00
AGP,https://vietstock.vn/2026/03/agp-tai-lieu-hop-dai-hoi-dong-co-dong-737-1409695.htm,AGP: Tài liệu họp Đại hội đồng cổ đông,2026-03-09T10:13:00
MCF,https://vietstock.vn/2026/01/mcf-bao-cao-quan-tri-cong-ty-nam-2025-737-1396861.htm,MCF: Báo cáo quản trị công ty năm 2025,2026-01-29T16:56:00
VGG,https://vietstock.vn/2026/02/vgg-bao-cao-tai-chinh-quy-4-2025-cong-ty-me-737-1399309.htm,VGG: Báo cáo tài chính quý 4/2025 (công ty mẹ),2026-02-02T18:25:00
PJT,https://vietstock.vn/2026/03/pjt-thu-moi-tham-du-va-tai-lieu-hop-dhdcd-tn-2026-737-1412970.htm,PJT: Thư mời tham dự và tài liệu họp ĐHĐCĐ TN 2026,2026-03-17T10:56:38
SBV,https://vietstock.vn/2026/02/sbv-quyet-dinh-ve-viec-thay-doi-dang-ky-niem-yet-741-1405825.htm,SBV: Quyết định về việc thay đổi đăng ký niêm yết,2026-02-26T14:32:12
BSQ,https://vietstock.vn/2026/02/bsq-thong-bao-ngay-dang-ky-cuoi-cung-de-thuc-hien-quyen-tham-du-dai-hoi-dong-co-dong-thuong-nien-nam-2026-737-1403250.htm,BSQ: Thông báo ngày đăng ký cuối cùng để thực hiện quyền tham dự Đại hội đồng cổ đông thường niên năm 2026,2026-02-12T10:38:00
MAC,https://vietstock.vn/2026/02/mac-ngay-12-02-2026-thong-bao-ngay-giao-dich-dau-tien-thay-doi-dang-ky-niem-yet-741-1401732.htm,"MAC: Ngày 12/02/2026, Thông báo ngày giao dịch đầu tiên thay đổi đăng ký niêm yết",2026-02-09T08:27:00
DLD,https://vietstock.vn/2025/08/dld-thay-doi-giay-dang-ky-kinh-doanh-737-1337740.htm,DLD: Thay đổi giấy đăng ký kinh doanh,2025-08-04T16:48:00
TMP,https://vietstock.vn/2026/03/tmp-nghi-quyet-hdqt-ve-viec-thong-qua-giao-dich-voi-cong-ty-co-phan-my-hung-tay-nguyen-737-1406969.htm,TMP: Nghị quyết HĐQT về việc thông qua giao dịch với Công ty Cổ phần Mỹ Hưng Tây Nguyên,2026-03-02T13:44:09
BTT,https://vietstock.vn/2026/03/cii124021-cong-bo-thong-tin-ve-viec-kbtt-cong-ty-con-100-von-cua-cii-tiep-tuc-nhan-ban-giao-mat-bang-de-trien-khai-du-an-bt-tai-khu-do-thi-moi-thu-thiem-737-1416716.htm,"CII124021: Công bố thông tin về việc KBTT, công ty con 100% vốn của CII, tiếp tục nhận bàn giao mặt bằng để triển khai Dự án BT tại Khu đô thị mới Thủ Thiêm",2026-03-26T10:00:00
PVH,https://vietstock.vn/2026/01/pvh-bao-cao-tai-chinh-quy-4-2025-737-1390952.htm,PVH: Báo cáo tài chính quý 4/2025,2026-01-14T18:04:00
UPS,https://vietstock.vn/2026/03/ups-upsc_cbtt-bao-cao-thuong-nien-nam-2025-cua-cong-ty-co-phan-chung-khoan-up-2025-annual-report-of-up-securities-joint-stock-company-737-1413154.htm,UPS: UPSC_CBTT Báo cáo thường niên năm 2025 của Công ty cổ phần chứng khoán UP/ 2025 Annual Report of UP Securities Joint Stock Company,2026-03-17T00:00:00
CTT,https://vietstock.vn/2026/01/ctt-bao-cao-quan-tri-cong-ty-nam-2025-737-1392253.htm,CTT: Báo cáo quản trị công ty năm 2025,2026-01-19T15:37:00
VE1,https://vietstock.vn/2026/01/ve1-bao-cao-quan-tri-cong-ty-nam-2025-737-1393292.htm,VE1: Báo cáo quản trị công ty năm 2025,2026-01-21T10:18:00
VTG,https://vietstock.vn/2026/02/vtg-nghi-quyet-hoi-dong-quan-tri-737-1402046.htm,VTG: Nghị quyết Hội đồng quản trị,2026-02-09T16:49:00
STB,https://vietstock.vn/2026/04/sacombank-tien-phong-ket-noi-thanh-toan-qr-xuyen-bien-gioi-viet-nam-8211-trung-quoc-757-1422969.htm,SACOMBANK tiên phong kết nối thanh toán QR xuyên biên giới Việt Nam – Trung Quốc,2026-04-04T09:11:33.327
HTG,https://vietstock.vn/2026/03/htg-nghi-quyet-hdqt-thong-qua-viec-vay-von-tai-ngan-hang-tmcp-cong-thuong-viet-nam-chi-nhanh-da-nang-737-1407226.htm,HTG: Nghị quyết HĐQT thông qua việc vay vốn tại Ngân hàng TMCP Công Thương Việt Nam - Chi nhánh Đà Nẵng,2026-03-02T17:37:32
LO5,https://vietstock.vn/2026/03/lo5-bao-cao-thuong-nien-2025-737-1415514.htm,LO5: Báo cáo thường niên 2025,2026-03-24T11:10:00
DBD,https://vietstock.vn/2026/01/dbd-bctc-quy-4-nam-2025-737-1395798.htm,DBD: BCTC quý 4 năm 2025 ,2026-01-26T00:00:00
GCF,https://vietstock.vn/2026/02/gcf-bao-cao-quan-tri-cong-ty-nam-2025-737-1398504.htm,GCF: Báo cáo quản trị công ty năm 2025,2026-02-02T09:32:00
TMG,https://vietstock.vn/2026/02/tmg-tam-ung-co-tuc-nam-tai-chinh-2025-bang-tien-738-1401589.htm,TMG: Tạm ứng cổ tức năm tài chính 2025 bằng tiền,2026-02-06T18:21:00
TAR,https://vietstock.vn/2026/01/tar-nghi-quyet-hoi-dong-quan-tri-737-1391495.htm,TAR: Nghị quyết Hội đồng quản trị,2026-01-16T10:31:00
MLC,https://vietstock.vn/2026/01/mlc-nghi-quyet-hoi-dong-quan-tri-737-1396270.htm,MLC: Nghị quyết Hội đồng quản trị,2026-01-28T15:51:00
BTG,https://vietstock.vn/2026/01/btg-tai-lieu-hop-dai-hoi-dong-co-dong-737-1387784.htm,BTG: Tài liệu họp Đại hội đồng cổ đông,2026-01-05T15:43:00
TED,https://vietstock.vn/2025/12/ted-nghi-quyet-hdqt-thong-qua-chu-truong-thuc-hien-cac-hop-dong-giao-dich-nam-2026-voi-cac-cong-ty-con-va-nguoi-co-lien-quan-737-1381514.htm,TED: Nghị quyết HĐQT thông qua chủ trương thực hiện các hợp đồng giao dịch năm 2026 với các Công ty con và Người có liên quan,2025-12-16T10:33:00
SAL,https://vietstock.vn/2025/09/sal-tran-huu-tho-uy-vien-hdqt-tong-giam-doc-da-mua-118000-cp-739-1348419.htm,"SAL: Trần Hữu Thọ - Ủy viên HĐQT, Tổng Giám đốc - đã mua 118,000 CP",2025-09-03T15:39:00
RAT,https://vietstock.vn/2025/07/rat-ngay-dang-ky-cuoi-cung-tra-co-tuc-bang-tien-mat-737-1325093.htm,RAT: Ngày đăng ký cuối cùng trả cổ tức bằng tiền mặt,2025-07-04T15:44:00
DCF,https://vietstock.vn/2026/03/dcf-tai-lieu-hop-dai-hoi-dong-co-dong-737-1417102.htm,DCF: Tài liệu họp Đại hội đồng cổ đông,2026-03-26T17:09:00
HVH,https://vietstock.vn/2026/02/hvh-thong-bao-ve-viec-niem-yet-va-giao-dich-chung-khoan-thay-doi-niem-yet-741-1403738.htm,HVH: Thông báo về việc niêm yết và giao dịch chứng khoán thay đổi niêm yết,2026-02-13T09:40:13
HFB,https://vietstock.vn/2025/11/hfb-ky-hop-dong-kiem-toan-bao-cao-tai-chinh-2025-737-1371195.htm,HFB: Ký hợp đồng kiểm toán Báo cáo tài chính 2025,2025-11-11T15:39:00
QHW,https://vietstock.vn/2026/02/qhw-tai-lieu-hop-dai-hoi-dong-co-dong-737-1403040.htm,QHW: Tài liệu họp Đại hội đồng cổ đông,2026-02-11T16:58:00
HC3,https://vietstock.vn/2026/02/bao-nhieu-doanh-nghiep-bat-dong-san-nha-o-can-dich-loi-nhuan-2025-737-1402811.htm,Bao nhiêu doanh nghiệp bất động sản nhà ở cán đích lợi nhuận 2025?,2026-02-21T10:02:00
NCT,https://vietstock.vn/2026/02/san-bay-moi-hang-bay-moi-nganh-hang-khong-2026-day-bien-so-737-1403812.htm,"Sân bay mới, hãng bay mới - ngành hàng không 2026 đầy biến số",2026-02-22T13:02:00
MVC,https://vietstock.vn/2026/02/mvc-bao-cao-tai-chinh-quy-4-2025-737-1399716.htm,MVC: Báo cáo tài chính quý 4/2025,2026-02-03T15:26:00
PRT,https://vietstock.vn/2025/11/prt-bao-cao-tai-chinh-quy-3-2025-cong-ty-me-737-1368994.htm,PRT: Báo cáo tài chính quý 3/2025 (công ty mẹ),2025-11-03T14:57:00
DIG,https://vietstock.vn/2026/03/dig-nghi-quyet-hdqt-ve-viec-phe-duyet-chu-truong-gop-von-thanh-lap-cong-ty-tnhh-bat-dong-san-saigonres-van-xuan-737-1417178.htm,DIG: Nghị quyết HĐQT về việc phê duyệt chủ trương góp vốn thành lập Công ty TNHH Bất động sản Saigonres Vạn Xuân,2026-03-26T17:46:36
FTI,https://vietstock.vn/2026/03/fti-ve-viec-phan-cong-cac-tieu-ban-va-thanh-vien-phuc-vu-dhdcd-thuong-nien-nam-2026-737-1417555.htm,FTI: Về việc phân công các tiểu ban và thành viên phục vụ ĐHĐCĐ thường niên năm 2026,2026-03-27T14:45:00
ACM,https://vietstock.vn/2025/07/acm-nghi-quyet-dai-hoi-dong-co-dong-thuong-nien-nam-2025-737-1328038.htm,ACM: Nghị quyết Đại hội đồng cổ đông thường niên năm 2025,2025-07-14T17:02:00
HTI,https://vietstock.vn/2026/01/hti-lai-ky-luc-trong-2025-co-phieu-tang-tran-737-1392673.htm,"HTI lãi kỷ lục trong 2025, cổ phiếu tăng trần",2026-01-20T14:30:00
SJE,https://vietstock.vn/2026/03/sje-bao-cao-tai-chinh-nam-2025-cong-ty-me-737-1410983.htm,SJE: Báo cáo tài chính năm 2025 (Công ty mẹ),2026-03-11T16:11:00
MND,https://vietstock.vn/2026/03/mnd-thong-bao-ngay-dang-ky-cuoi-cung-thuc-hien-quyen-tham-du-dai-hoi-dong-co-dong-thuong-nien-nam-2026-737-1408224.htm,MND: Thông báo ngày đăng ký cuối cùng thực hiện quyền tham dự đại hội đồng cổ đông thường niên năm 2026,2026-03-04T14:44:00
NAW,https://vietstock.vn/2026/02/naw-nghi-quyet-hoi-dong-quan-tri-737-1405388.htm,NAW: Nghị quyết Hội đồng quản trị,2026-02-25T10:47:00
